symbol,name,exchange,status,source,security_type,sector,industry_gics,industry_fdr,industry_code,headquarters,cik,founded,isin,has_price_csv,downloaded_rows,effective_date
DK,"Delek US Holdings, Inc. Common Stock",N,active,nasdaq,,,,"오일, 가스 정제 및 마케팅",50102030.0,,,,US24665A1034,True,5085,
DKI,DarkIris Inc. - Class A Ordinary Shares,Q,active,nasdaq,,,,소프트웨어,57201020.0,,,,,True,238,
DKNG,DraftKings Inc. - Class A Common Stock,Q,active,nasdaq,,,,카지노 및 도박,53301030.0,,,,,True,1757,
DKS,Dick's Sporting Goods Inc Common Stock,N,active,nasdaq,,,,기타 전문 소매,53403090.0,,,,US2533931026,True,5978,
DLB,Dolby Laboratories Common Stock,N,active,nasdaq,,,,소프트웨어,57201020.0,,,,US25659T1079,True,5389,
DLHC,DLH Holdings Corp. - Common Stock,Q,active,nasdaq,,,,IT 서비스 및 컨설팅,57201010.0,,,,US23335Q1004,True,10113,
DLO,DLocal Limited - Class A Common Shares,Q,active,nasdaq,,,,경영 지원 서비스,52203040.0,,,,,True,1289,
DLPN,"Dolphin Entertainment, Inc. - Common Stock",Q,active,nasdaq,,,,엔터테인먼트 제작,53302030.0,,,,US25686H1005,True,4957,
DLR,"Digital Realty Trust, Inc. Common Stock",N,active,nasdaq,,Real Estate,Data Center REITs,특수 REITs,60102040.0,"Austin, Texas",1297996.0,2004,US2538681030,True,5358,
DLTH,Duluth Holdings Inc. - Class B Common Stock,Q,active,nasdaq,,,,의류 및 액세서리,53202020.0,,,,US26443V1017,True,2680,
DLTR,"Dollar Tree, Inc. - Common Stock",Q,active,nasdaq,,Consumer Staples,Consumer Staples Merchandise Retail,할인점,53402020.0,"Chesapeake, Virginia",935703.0,1986,US2567461080,True,7896,
DLX,Deluxe Corporation Common Stock,N,active,nasdaq,,,,상업 인쇄 서비스,52203020.0,,,,US2480191012,True,11681,
DLXY,Delixy Holdings Limited - Class A Ordinary Shares,Q,active,nasdaq,,,,"오일, 가스 정제 및 마케팅",50102030.0,,,,,True,261,
DLY,DoubleLine Yield Opportunities Fund Common Shares of Beneficial Interest,N,active,nasdaq,,,,폐쇄형 펀드,55501030.0,,,,,True,1609,
DMA,Destra Multi-Alternative Fund Common Stock,N,active,nasdaq,,,,,,,,,,True,1133,
DMAA,Drugs Made In America Acquisition Corp. - Ordinary Shares,Q,active,nasdaq,,,,투자 지주 회사,55601010.0,,,,,True,352,
DMAAR,Drugs Made In America Acquisition Corp. - Rights,Q,unavailable,nasdaq,,,,투자 지주 회사,55601010.0,,,,,False,0,
DMAC,DiaMedica Therapeutics Inc. - Common Stock,Q,active,nasdaq,,,,생명 공학 및 의학 연구,56202010.0,,,,,True,3510,
DMB,"BNY Mellon Municipal Bond Infrastructure Fund, Inc. Common Stock",N,active,nasdaq,,,,폐쇄형 펀드,55501030.0,,,,,True,3329,
DMC,Del Monte Corporation Ordinary Shares,N,active,nasdaq,,,,어업 및 농업,54102010.0,,,,,True,7228,
DMII,Drugs Made In America Acquisition II Corp. - Ordinary Shares,Q,active,nasdaq,,,,투자 지주 회사,55601010.0,,,,,True,157,
DMIIR,Drugs Made In America Acquisition II Corp. - Right,Q,unavailable,nasdaq,,,,투자 지주 회사,55601010.0,,,,,False,0,
DMO,Western Asset Mortgage Opportunity Fund Inc. Common Stock,N,active,nasdaq,,,,폐쇄형 펀드,55501030.0,,,,,True,4127,
DMRA,"Damora Therapeutics, Inc. - Ordinary Shares",Q,active,nasdaq,,,,생명 공학 및 의학 연구,56202010.0,,,,,True,1437,
DMRC,Digimarc Corporation - Common Stock,Q,active,nasdaq,,,,,,,,,US25381B1017,True,6698,
DNA,"Ginkgo Bioworks Holdings, Inc. Class A Common Stock",N,active,nasdaq,,,,생명 공학 및 의학 연구,56202010.0,,,,,True,1321,
DNLI,Denali Therapeutics Inc. - Common Stock,Q,active,nasdaq,,,,생명 공학 및 의학 연구,56202010.0,,,,US24823R1059,True,2164,
DNMX,Dynamix Corporation III - Class A Ordinary Shares,Q,active,nasdaq,,,,투자 지주 회사,55601010.0,,,,,True,166,
DNN,Denison Mines Corp Ordinary Shares (Canada),A,active,nasdaq,,,,우라늄,50301010.0,,,,CA2483561072,True,5395,
DNOW,DNOW Inc. Common Stock,N,active,nasdaq,,,,산업용 기계 및 장비,52102010.0,,,,US67011P1003,True,3061,
DNP,"DNP Select Income Fund, Inc. Common Stock",N,active,nasdaq,,,,폐쇄형 펀드,55501030.0,,,,,True,9950,
DNTH,"Dianthus Therapeutics, Inc. - Common Stock",Q,active,nasdaq,,,,생명 공학 및 의학 연구,56202010.0,,,,,True,2031,
DNUT,"Krispy Kreme, Inc. - Common Stock",Q,active,nasdaq,,,,레스토랑 및 바,53301020.0,,,,,True,1269,
DOC,"Healthpeak Properties, Inc. Common Stock",N,active,nasdaq,,Real Estate,Health Care REITs,특수 REITs,60102040.0,"Denver, Colorado",765880.0,1985,US71943U1043,True,10369,
DOCN,"DigitalOcean Holdings, Inc. Common Stock",N,active,nasdaq,,,,IT 서비스 및 컨설팅,57201010.0,,,,,True,1338,
DOCS,"Doximity, Inc. Class A Common Stock",N,active,nasdaq,,,,소프트웨어,57201020.0,,,,,True,1274,
DOCU,"DocuSign, Inc. - Common Stock",Q,active,nasdaq,,,,소프트웨어,57201020.0,,,,US2561631068,True,2069,
DOGZ,Dogness (International) Corporation - Class A Common Stock,Q,active,nasdaq,,,,의류 및 액세서리,53202020.0,,,,VGG2788T1030,True,2156,
DOLE,Dole plc Ordinary Shares,N,active,nasdaq,,,,어업 및 농업,54102010.0,,,,,True,1249,
DOMH,Dominari Holdings Inc. - Common Stock,Q,active,nasdaq,,,,투자 은행 및 중개 서비스,55102010.0,,,,,True,11680,
DOMO,"Domo, Inc. - Class B Common Stock",Q,active,nasdaq,,,,소프트웨어,57201020.0,,,,US2575541055,True,2025,
DOO,BRP Inc. - Common Subordinate Voting Shares,Q,active,nasdaq,,,,오락용 제품,53205020.0,,,,,True,3258,
DORM,"Dorman Products, Inc. - Common Stock",Q,active,nasdaq,,,,"자동차, 트럭 및 오토바이 부품",53101020.0,,,,US2582781009,True,8904,
DOUG,Douglas Elliman Inc. Common Stock,N,active,nasdaq,,,,부동산 서비스,60101020.0,,,,,True,1143,
DOV,Dover Corporation Common Stock,N,active,nasdaq,,Industrials,Industrial Machinery & Supplies & Components,산업용 기계 및 장비,52102010.0,"Downers Grove, Illinois",29905.0,1955,US2600031080,True,11681,
DOW,Dow Inc. Common Stock ,N,active,nasdaq,,Materials,Commodity Chemicals,상품 화학,51101010.0,"Midland, Michigan",1751788.0,2019 (1897),US2605571031,True,1738,
DOX,Amdocs Limited - Ordinary Shares,Q,active,nasdaq,,,,IT 서비스 및 컨설팅,57201010.0,,,,GB0022569080,True,7065,
DOYU,DouYu International Holdings Limited - American Depositary Shares,Q,active,nasdaq,,,,온라인 서비스,57201030.0,,,,US25985W1053,True,1762,
DPC,DPC Holdings PLC Ordinary Shares,N,active,nasdaq,,,,,,,,,,True,19,
DPG,Duff & Phelps Utility and Infrastructure Fund Inc.,N,active,nasdaq,,,,폐쇄형 펀드,55501030.0,,,,,True,3765,
DPRO,Draganfly Inc. - Common Shares,Q,active,nasdaq,,,,항공우주 및 방위,52101010.0,,,,,True,1389,
DPU,Top KingWin Ltd - Class A Ordinary Shares,Q,active,nasdaq,,,,전문 정보 서비스,52203070.0,,,,,True,817,
DPZ,Domino's Pizza Inc - Common Stock,Q,active,nasdaq,,Consumer Discretionary,Restaurants,레스토랑 및 바,53301020.0,"Ann Arbor, Michigan",1286681.0,1960,US25754A2015,True,5435,
DQ,"DAQO New Energy Corp. American Depositary Shares, each representing five ordinary shares",N,active,nasdaq,,,,재생 가능 에너지 장비 및 서비스,50201010.0,,,,US23703Q2030,True,3970,
DRCT,"Direct Digital Holdings, Inc. - Class A Common Stock",Q,active,nasdaq,,,,광고 및 마케팅,53302010.0,,,,,True,1113,
DRD,DRDGOLD Limited American Depositary Shares,N,active,nasdaq,,,,금,51201060.0,,,,US26152H3012,True,8100,
DRDB,Roman DBDR Acquisition Corp. II - Ordinary shares,Q,active,nasdaq,,,,투자 지주 회사,55601010.0,,,,,True,368,
DRH,Diamondrock Hospitality Company - Common Stock,Q,active,nasdaq,,,,특수 REITs,60102040.0,,,,US2527843013,True,5321,
DRI,"Darden Restaurants, Inc. Common Stock",N,active,nasdaq,,Consumer Discretionary,Restaurants,레스토랑 및 바,53301020.0,"Orlando, Florida",940944.0,1938,US2371941053,True,7852,
DRIO,DarioHealth Corp. - Common Stock,Q,active,nasdaq,,,,"의료 장비, 물품 및 유통",56101020.0,,,,US23725P1003,True,2604,
DRMA,"Dermata Therapeutics, Inc. - Common Stock",Q,active,nasdaq,,,,생명 공학 및 의학 연구,56202010.0,,,,,True,1238,
DRS,"Leonardo DRS, Inc. - Common Stock",Q,active,nasdaq,,,,항공우주 및 방위,52101010.0,,,,,True,10348,
DRTS,Alpha Tau Medical Ltd. - Ordinary Shares,Q,active,nasdaq,,,,첨단 의료 장비 및 기술,56101010.0,,,,,True,1350,
DRUG,Bright Minds Biosciences Inc. - common stock,Q,active,nasdaq,,,,생명 공학 및 의학 연구,56202010.0,,,,,True,1340,
DRVN,Driven Brands Holdings Inc. - Common Stock,Q,active,nasdaq,,,,개인 서비스,54201030.0,,,,,True,1383,
DSAC,Daedalus Special Acquisition Corp. - Class A Ordinary Shares,Q,active,nasdaq,,,,투자 지주 회사,55601010.0,,,,,True,119,
DSC,DSC Holdings Ltd. - American Depositary Shares,Q,active,nasdaq,,,,온라인 서비스,57201030.0,,,,,True,19,
DSGN,"Design Therapeutics, Inc. - Common Stock",Q,active,nasdaq,,,,생명 공학 및 의학 연구,56202010.0,,,,,True,1335,
DSGR,"Distribution Solutions Group, Inc. - Common Stock",Q,active,nasdaq,,,,산업용 기계 및 장비,52102010.0,,,,,True,11681,
DSGX,The Descartes Systems Group Inc. - Common Stock,Q,active,nasdaq,,,,소프트웨어,57201020.0,,,,CA2499061083,True,6913,
DSL,DoubleLine Income Solutions Fund Common Shares of Beneficial Interests,N,active,nasdaq,,,,폐쇄형 펀드,55501030.0,,,,,True,3329,
DSM,"BNY Mellon Strategic Municipal Bond Fund, Inc. Common Stock",N,active,nasdaq,,,,폐쇄형 펀드,55501030.0,,,,,True,9231,
DSP,Viant Technology Inc. - common stock,Q,active,nasdaq,,,,소프트웨어,57201020.0,,,,,True,1367,
DSS,"DSS, Inc. Common Stock",A,active,nasdaq,,,,종이 포장재,51302020.0,,,,US25614T2006,True,8125,
DSU,"Blackrock Debt Strategies Fund, Inc. Common Stock",N,active,nasdaq,,,,폐쇄형 펀드,55501030.0,,,,,True,7122,
DSWL,"Deswell Industries, Inc. - Common Shares",Q,active,nasdaq,,,,상품 화학,51101010.0,,,,VG2506391011,True,7802,
DSX,Diana Shipping inc. common stock,N,active,nasdaq,,,,해양 화물 및 물류,52405020.0,,,,MHY2066G1044,True,5366,
DSY,Big Tree Cloud Holdings Limited - Class A Ordinary Shares,Q,active,nasdaq,,,,개인 생활 필수 용품,54201020.0,,,,,True,884,
DT,"Dynatrace, Inc. Common Stock",N,active,nasdaq,,,,IT 서비스 및 컨설팅,57201010.0,,,,,True,1752,
DTB,DTE Energy Company 2020 Series G 4.375% Junior Subordinated Debentures due 2080,N,active,nasdaq,,,,전력 유틸리티,59101010.0,,,,,True,1453,
DTCX,"Datacentrex, Inc. - Common Stock",Q,active,nasdaq,,,,블록 체인 및 암호화폐,57301030.0,,,,,True,1088,
DTE,DTE Energy Company Common Stock,N,active,nasdaq,,Utilities,Multi-Utilities,전력 유틸리티,59101010.0,"Detroit, Michigan",936340.0,1995,US2333311072,True,16246,
DTF,DTF Tax-Free Income 2028 Term Fund Inc. Common Stock,N,active,nasdaq,,,,폐쇄형 펀드,55501030.0,,,,,True,8725,
DTG,DTE Energy Company 2021 Series E 4.375% Junior Subordinated Debentures,N,active,nasdaq,,,,전력 유틸리티,59101010.0,,,,,True,1163,
DTI,Drilling Tools International Corporation  - Common Stock,Q,active,nasdaq,,,,오일 관련 서비스 및 장비,50103020.0,,,,,True,1144,
DTIL,"Precision BioSciences, Inc. - Common Stock",Q,active,nasdaq,,,,생명 공학 및 의학 연구,56202010.0,,,,,True,1839,
DTK,DTE Energy Company 2025 Series H 6.25% Junior Subordinated Debentures due 2085,N,active,nasdaq,,,,전력 유틸리티,59101010.0,,,,,True,209,
DTM,"DT Midstream, Inc. Common Stock ",N,active,nasdaq,,,,오일 및 가스 수송 서비스,50103030.0,,,,,True,1269,
DTSQ,DT Cloud Star Acquisition Corporation - Ordinary Shares,Q,active,nasdaq,,,,투자 지주 회사,55601010.0,,,,,True,462,
DTSQR,DT Cloud Star Acquisition Corporation - Right,Q,unavailable,nasdaq,,,,투자 지주 회사,55601010.0,,,,,False,0,
DTSS,Datasea Intelligent Technology Ltd. - Class A Ordinary Shares,Q,active,nasdaq,,,,소프트웨어,57201020.0,,,,US2381162062,True,2106,
DTST,Data Storage Corporation - Common Stock,Q,active,nasdaq,,,,온라인 소액 투자 중개,57301020.0,,,,,True,3609,
DTW,DTE Energy Company 2017 Series E 5.25% Junior Subordinated Debentures due 2077,N,active,nasdaq,,,,전력 유틸리티,59101010.0,,,,,True,2092,
DUK,Duke Energy Corporation (Holding Company) Common Stock,N,active,nasdaq,,Utilities,Electric Utilities,전력 유틸리티,59101010.0,"Charlotte, North Carolina",1326160.0,1904,US26441C2044,True,11681,
DUKB,Duke Energy Corporation 5.625% Junior Subordinated Debentures due 2078,N,active,nasdaq,,,,전력 유틸리티,59101010.0,,,,,True,1948,
DUKR,DUKE Robotics Corp. - Common Stock,Q,active,nasdaq,,,,항공우주 및 방위,52101010.0,,,,,True,1389,
DUO,Fangdd Network Group Ltd. - Class A Ordinary Shares,Q,active,nasdaq,,,,부동산 서비스,60101020.0,,,,,True,1687,
DUOL,"Duolingo, Inc. - Class A Common Stock",Q,active,nasdaq,,,,온라인 서비스,57201030.0,,,,,True,1251,
DUOT,"Duos Technologies Group, Inc. - Common Stock",Q,active,nasdaq,,,,소프트웨어,57201020.0,,,,,True,2299,
DV,"DoubleVerify Holdings, Inc. Common Stock",N,active,nasdaq,,,,소프트웨어,57201020.0,,,,,True,1319,
DVA,DaVita Inc. Common Stock,N,active,nasdaq,,Health Care,Health Care Services,의료 시설 및 서비스,56102010.0,"Denver, Colorado",927066.0,1979,US23918K1088,True,7730,
DVLT,Datavault AI Inc. - Common Stock,Q,active,nasdaq,,,,IT 서비스 및 컨설팅,57201010.0,,,,,True,2006,
DVN,Devon Energy Corporation Common Stock,N,active,nasdaq,,Energy,Oil & Gas Exploration & Production,"오일, 가스 탐사 및 생산",50102020.0,"Oklahoma City, Oklahoma",1090012.0,1971,US25179M1036,True,10329,
DWSN,Dawson Geophysical Company - Common Stock,Q,active,nasdaq,,,,오일 관련 서비스 및 장비,50103020.0,,,,US2393601008,True,8128,
DWTX,"Dogwood Therapeutics, Inc.  - Common Stock",Q,active,nasdaq,,,,생명 공학 및 의학 연구,56202010.0,,,,,True,1402,
DX,"Dynex Capital, Inc. Common Stock",N,active,nasdaq,,,,특수 REITs,60102040.0,,,,US26817Q8868,True,9683,
DXC,DXC Technology Company Common Stock ,N,active,nasdaq,,,,IT 서비스 및 컨설팅,57201010.0,,,,US23355L1061,True,11228,
DXCM,"DexCom, Inc. - Common Stock",Q,active,nasdaq,,Health Care,Health Care Equipment,"의료 장비, 물품 및 유통",56101020.0,"San Diego, California",1093557.0,1999,US2521311074,True,5244,
DXF,"Eason Technology Limited American Depositary Shares (each representing sixty-thousand (60,000) Ordinary Shares)",A,active,nasdaq,,,,소비자 대출,55101030.0,,,,,True,374,
DXLG,"Destination XL Group, Inc. - Common Stock",Q,active,nasdaq,,,,의류 및 액세서리 소매,53403040.0,,,,US25065K1043,True,9858,
DXPE,"DXP Enterprises, Inc. - Common Stock",Q,active,nasdaq,,,,산업용 기계 및 장비,52102010.0,,,,US2333774071,True,7095,
DXR,Daxor Corporation - Closed End Fund,Q,active,nasdaq,,,,폐쇄형 펀드,55501030.0,,,,US2394671034,True,10832,
DXST,Decent Holding Inc. - Class A Ordinary Shares,Q,active,nasdaq,,,,환경 서비스 및 장비,52203010.0,,,,,True,376,
DXYZ,Destiny Tech100 Inc. Common Stock,N,active,nasdaq,,,,폐쇄형 펀드,55501030.0,,,,,True,582,
DY,"Dycom Industries, Inc. Common Stock",N,active,nasdaq,,,,건설 및 엔지니어링,52201020.0,,,,US2674751019,True,10615,
DYAI,"Dyadic International, Inc. - Common Stock",Q,active,nasdaq,,,,생명 공학 및 의학 연구,56202010.0,,,,,True,4657,
DYN,"Dyne Therapeutics, Inc. - Common Stock",Q,active,nasdaq,,,,생명 공학 및 의학 연구,56202010.0,,,,,True,1467,
DYNC,Dynamix Corporation - Class A Ordinary Share,Q,active,nasdaq,,,,투자 지주 회사,55601010.0,,,,,True,404,
DYOR,Insight Digital Partners II - Class A Ordinary Shares,Q,active,nasdaq,,,,투자 지주 회사,55601010.0,,,,,True,167,
DZZ,"DB Gold Double Short ETN due February 15, 2038",P,active,nasdaq,,,,,,,,,,True,4628,
E,ENI S.p.A. Common Stock,N,active,nasdaq,,,,통합 오일 및 가스,50102010.0,,,,US26874R1086,True,7711,
EA,Electronic Arts Inc. - Common Stock,Q,active,nasdaq,,Communication Services,Interactive Home Entertainment,소프트웨어,57201020.0,"Redwood City, California",712515.0,1982,US2855121099,True,9276,
EAD,Allspring Income Opportunities Fund Common Shares,A,active,nasdaq,,,,폐쇄형 펀드,55501030.0,,,,US94987B1052,True,5888,
EAF,GrafTech International Ltd. Common Stock,N,active,nasdaq,,,,전기 부품 및 장비,52102030.0,,,,,True,2075,
EAI,"Entergy Arkansas, LLC First Mortgage Bonds, 4.875% Series Due September 1, 2066",N,active,nasdaq,,,,전력 유틸리티,59101010.0,,,,,True,121,
EARN,Ellington Credit Company Common Shares of Beneficial Interest,N,active,nasdaq,,,,폐쇄형 펀드,55501030.0,,,,,True,3326,
EAT,"Brinker International, Inc. Common Stock",N,active,nasdaq,,,,레스토랑 및 바,53301020.0,,,,US1096411004,True,10718,
EBAY,eBay Inc. - Common Stock,Q,active,nasdaq,,Consumer Discretionary,Broadline Retail,온라인 서비스,57201030.0,"San Jose, California",1065088.0,1995,US2786421030,True,6998,
EBC,"Eastern Bankshares, Inc. - Common Stock",Q,active,nasdaq,,,,은행,55101010.0,,,,,True,1447,
EBF,"Ennis, Inc. Common Stock",N,active,nasdaq,,,,상업 인쇄 서비스,52203020.0,,,,US2933891028,True,11681,
EBMT,"Eagle Bancorp Montana, Inc. - Common Stock",Q,active,nasdaq,,,,은행,55101010.0,,,,US26942G1004,True,6611,
EBON,Ebang International Holdings Inc. - Class A Ordinary Shares,Q,active,nasdaq,,,,반도체,57101010.0,,,,,True,1523,
EBS,Emergent BioSolutions Inc. Common Stock,N,active,nasdaq,,,,제약,56201040.0,,,,US29089Q1058,True,4949,
EC,Ecopetrol S.A. American Depositary Shares,N,active,nasdaq,,,,"오일, 가스 탐사 및 생산",50102020.0,,,,US2791581091,True,4487,
ECAT,BlackRock ESG Capital Allocation Term Trust Common Shares of Beneficial Interest,N,active,nasdaq,,,,투자 관리 및 펀드 운영,55102020.0,,,,,True,1208,
ECBK,"ECB Bancorp, Inc. - Common Stock",Q,active,nasdaq,,,,은행,55101010.0,,,,,True,998,
ECC,Eagle Point Credit Company Common Share of Beneficial Interest,N,active,nasdaq,,,,폐쇄형 펀드,55501030.0,,,,,True,2963,
ECCU,Eagle Point Credit Company 7.75% Notes due 2030,N,active,nasdaq,,,,,,,,,,True,396,
ECCV,Eagle Point Credit Company 5.375% Notes due 2029,N,active,nasdaq,,,,,,,,,,True,1125,
ECF,Ellsworth Growth and Income Fund Ltd.,A,active,nasdaq,,,,폐쇄형 펀드,55501030.0,,,,US2890741067,True,10097,
ECG,"Everus Construction Group, Inc. Common Stock",N,active,nasdaq,,,,건설 및 엔지니어링,52201020.0,,,,,True,433,
ECHO,EchoStar Corporation - Common stock,Q,active,nasdaq,,,,무선 통신 서비스,57401020.0,,,,US27875T1016,True,4667,
ECL,Ecolab Inc. Common Stock,N,active,nasdaq,,Materials,Specialty Chemicals,특수 화학제,51101030.0,"Saint Paul, Minnesota",31462.0,1923,US2788651006,True,13467,
ECO,Okeanis Eco Tankers Corp. Common Stock,N,active,nasdaq,,,,오일 및 가스 수송 서비스,50103030.0,,,,,True,737,
ECOR,"electroCore, Inc. - Common Stock",Q,active,nasdaq,,,,"의료 장비, 물품 및 유통",56101020.0,,,,,True,2030,
ECPG,Encore Capital Group Inc - Common Stock,Q,active,nasdaq,,,,기업 금융 서비스,55101050.0,,,,US2925541029,True,6800,
ECVT,Ecovyst Inc. Common Stock,N,active,nasdaq,,,,다각적 화학 산업,51101090.0,,,,,True,2213,
ECX,ECARX Holdings Inc. - Class A Ordinary shares,Q,active,nasdaq,,,,통합 하드웨어 및 소프트웨어,57107010.0,,,,,True,1333,
ED,"Consolidated Edison, Inc. Common Stock",N,active,nasdaq,,Utilities,Multi-Utilities,전력 유틸리티,59101010.0,"New York City, New York",1047862.0,1823,US2091151041,True,16246,
EDBL,Edible Garden AG Incorporated - Common Stock,Q,active,nasdaq,,,,어업 및 농업,54102010.0,,,,,True,1056,
EDD,"Morgan Stanley Emerging Markets Domestic Debt Fund, Inc. Common Stock",N,active,nasdaq,,,,폐쇄형 펀드,55501030.0,,,,,True,4842,
EDF,Virtus Stone Harbor Emerging Markets Income Fund Common Shares of Beneficial Interest,N,active,nasdaq,,,,폐쇄형 펀드,55501030.0,,,,,True,3915,
EDHL,Everbright Digital Holding Limited - Ordinary Shares,Q,active,nasdaq,,,,광고 및 마케팅,53302010.0,,,,,True,316,
EDIT,"Editas Medicine, Inc. - Common Stock",Q,active,nasdaq,,,,생명 공학 및 의학 연구,56202010.0,,,,US28106W1036,True,2631,
EDN,Empresa Distribuidora Y Comercializadora Norte S.A. (Edenor) American Depositary Shares,N,active,nasdaq,,,,전력 유틸리티,59101010.0,,,,US29244A1025,True,4840,
EDRY,EuroDry Ltd. - Common Shares,Q,active,nasdaq,,,,해양 화물 및 물류,52405020.0,,,,MHY235081079,True,2045,
EDSA,"Edesa Biotech, Inc. - Common Shares",Q,active,nasdaq,,,,생명 공학 및 의학 연구,56202010.0,,,,,True,4046,
EDTK,Skillful Craftsman Education Technology Limited - Ordinary Share,Q,active,nasdaq,,,,전문 및 비즈니스 교육,63103010.0,,,,,True,1506,
EDU,"New Oriental Education & Technology Group, Inc. Sponsored ADR representing 10 Ordinary Share (Cayman Islands)",N,active,nasdaq,,,,기타 교육 서비스 제공,63101010.0,,,,US6475811070,True,4992,
EDUC,Educational Development Corporation - Common Stock,Q,active,nasdaq,,,,소비자 출판,53302040.0,,,,US2814791057,True,11680,
EE,"Excelerate Energy, Inc. Class A Common Stock",N,active,nasdaq,,,,천연가스 유틸리티,59102010.0,,,,US2836778546,True,1071,
EEA,"The European Equity Fund, Inc. Common Stock",N,active,nasdaq,,,,폐쇄형 펀드,55501030.0,,,,,True,10079,
EEFT,"Euronet Worldwide, Inc. - Common Stock",Q,active,nasdaq,,,,경영 지원 서비스,52203040.0,,,,US2987361092,True,7389,
EEIQ,EpicQuest Education Group International Limited - Common Stock,Q,active,nasdaq,,,,"초, 중, 고등 교육기관",63102010.0,,,,,True,1337,
EFC,Ellington Financial Inc. Common Stock ,N,active,nasdaq,,,,특수 REITs,60102040.0,,,,,True,3969,
EFOI,"Energy Focus, Inc. - Common Stock",Q,active,nasdaq,,,,건설 자재 및 비품,53203020.0,,,,US29268T3005,True,8034,
EFOR,"Everforth, Inc. Common Stock",N,active,nasdaq,,,,IT 서비스 및 컨설팅,57201010.0,,,,,True,8516,
EFR,Eaton Vance Senior Floating-Rate Fund Common Shares of Beneficial Interest,N,active,nasdaq,,,,폐쇄형 펀드,55501030.0,,,,,True,5698,
EFSC,Enterprise Financial Services Corporation - Common Stock,Q,active,nasdaq,,,,은행,55101010.0,,,,US2937121059,True,5792,
EFSI,Eagle Financial Services Inc - Common Stock,Q,active,nasdaq,,,,은행,55101010.0,,,,,True,6298,
EFT,Eaton Vance Floating Rate Income Trust Common Shares of Beneficial Interest,N,active,nasdaq,,,,폐쇄형 펀드,55501030.0,,,,,True,5533,
EFTY,"Etoiles Capital Group Co., Ltd. - Class A Ordinary Shares",Q,active,nasdaq,,,,광고 및 마케팅,53302010.0,,,,,True,238,
EFX,"Equifax, Inc. Common Stock",N,active,nasdaq,,Industrials,Research & Consulting Services,전문 정보 서비스,52203070.0,"Atlanta, Georgia",33185.0,1899,US2944291051,True,11681,
EFXT,Enerflex Ltd Common Shares,N,active,nasdaq,,,,오일 관련 서비스 및 장비,50103020.0,,,,,True,3799,
EG,"Everest Group, Ltd. Common Stock",N,active,nasdaq,,Financials,Reinsurance,재보험,55301050.0,"Hamilton, Bermuda",1095073.0,1973,,True,7750,
EGAN,eGain Corporation - Common Stock,Q,active,nasdaq,,,,소프트웨어,57201020.0,,,,US28225C8064,True,6747,
EGBN,"Eagle Bancorp, Inc. - Common Stock",Q,active,nasdaq,,,,은행,55101010.0,,,,US2689481065,True,6797,
EGG,Enigmatig Limited Class A Ordinary Shares,A,active,nasdaq,,,,경영 지원 서비스,52203040.0,,,,,True,274,
EGHA,EGH Acquisition Corp. - Class A ordinary shares,Q,active,nasdaq,,,,투자 지주 회사,55601010.0,,,,,True,267,
EGHAR,EGH Acquisition Corp. - rights,Q,unavailable,nasdaq,,,,투자 지주 회사,55601010.0,,,,,False,0,
EGHT,8x8 Inc - Common stock,Q,active,nasdaq,,,,통합 통신 서비스,57401010.0,,,,US2829141009,True,7308,
EGO,Eldorado Gold Corporation Ordinary Shares,N,active,nasdaq,,,,금,51201060.0,,,,CA2849025093,True,5911,
EGP,"EastGroup Properties, Inc. Common Stock",N,active,nasdaq,,,,상업용 REITs,60102020.0,,,,US2772761019,True,13467,
EGY,"VAALCO Energy, Inc.  Common Stock",N,active,nasdaq,,,,"오일, 가스 탐사 및 생산",50102020.0,,,,US91851C2017,True,8426,
EH,EHang Holdings Limited - ADS,Q,active,nasdaq,,,,항공우주 및 방위,52101010.0,,,,,True,1658,
EHC,Encompass Health Corporation Common Stock,N,active,nasdaq,,,,의료 시설 및 서비스,56102010.0,,,,US29261A1007,True,10032,
EHGO,Eshallgo Inc. - Class A Ordinary Shares,Q,active,nasdaq,,,,비즈니스 지원 용품,52203060.0,,,,,True,515,
EHI,Western Asset Global High Income Fund Inc Common Stock,N,active,nasdaq,,,,폐쇄형 펀드,55501030.0,,,,,True,5782,
EHLD,Euroholdings Ltd. - Common Stock,Q,active,nasdaq,,,,해양 화물 및 물류,52405020.0,,,,,True,344,
EHTH,"eHealth, Inc. - Common Stock",Q,active,nasdaq,,,,복합보험 및 중개인,55301010.0,,,,US28238P1093,True,4967,
EIC,Eagle Point Income Company Inc. Common Stock,N,active,nasdaq,,,,폐쇄형 펀드,55501030.0,,,,,True,1758,
EIG,Employers Holdings Inc Common Stock,N,active,nasdaq,,,,손해보험,55301020.0,,,,US2922181043,True,4899,
EIKN,"Eikon Therapeutics, Inc. - Common Stock",Q,active,nasdaq,,,,생명 공학 및 의학 연구,56202010.0,,,,,True,115,
EIM,"Eaton Vance Municipal Bond Fund Common Shares of Beneficial Interest, $.01 par value",A,active,nasdaq,,,,폐쇄형 펀드,55501030.0,,,,US27827X1019,True,6012,
EIX,Edison International Common Stock,N,active,nasdaq,,Utilities,Electric Utilities,전력 유틸리티,59101010.0,"Rosemead, California",827052.0,1886,US2810201077,True,13417,
EJH,E-Home Household Service Holdings Limited - Ordinary shares,Q,active,nasdaq,,,,경영 지원 서비스,52203040.0,,,,,True,1302,
EL,"Estee Lauder Companies, Inc. (The) Common Stock",N,active,nasdaq,,Consumer Staples,Personal Care Products,개인 생활 필수 용품,54201020.0,"New York City, New York",1001250.0,1946,US5184391044,True,7717,
ELA,Envela Corporation Common Stock,A,active,nasdaq,,,,의류 및 액세서리 소매,53403040.0,,,,,True,8646,
ELAB,PMGC Holdings Inc. - Common Stock,Q,active,nasdaq,,,,용기(종이 제외) 및 포장재,51302010.0,,,,,True,667,
ELAN,Elanco Animal Health Incorporated Common Stock,N,active,nasdaq,,,,제약,56201040.0,,,,,True,1968,
ELBM,Electra Battery Materials Corporation - Common Stock,Q,active,nasdaq,,,,특수 채굴 및 금속,51201050.0,,,,,True,1389,
