symbol,name,exchange,status,source,security_type,sector,industry_gics,industry_fdr,industry_code,headquarters,cik,founded,isin,has_price_csv,downloaded_rows,effective_date
JLL,Jones Lang LaSalle Incorporated Common Stock,N,active,nasdaq,,,,부동산 서비스,60101020.0,,,,US48020Q1076,True,7298,
JLS,Nuveen Mortgage and Income Fund,N,active,nasdaq,,,,폐쇄형 펀드,55501030.0,,,,,True,4186,
JMIA,"Jumia Technologies AG American Depositary Shares, each representing two Ordinary Shares",N,active,nasdaq,,,,온라인 서비스,57201030.0,,,,,True,1828,
JMM,Nuveen Multi-Market Income Fund (MA),N,active,nasdaq,,,,폐쇄형 펀드,55501030.0,,,,,True,9460,
JMSB,"John Marshall Bancorp, Inc. - Common Stock",Q,active,nasdaq,,,,은행,55101010.0,,,,,True,2360,
JNJ,Johnson & Johnson Common Stock,N,active,nasdaq,,Health Care,Pharmaceuticals,제약,56201040.0,"New Brunswick, New Jersey",200406.0,1886,US4781601046,True,16246,
JOB,GEE Group Inc. Common Stock,A,active,nasdaq,,,,고용 서비스,52203030.0,,,,US36165A1025,True,11681,
JOBY,"Joby Aviation, Inc. Common Stock",N,active,nasdaq,,,,항공우주 및 방위,52101010.0,,,,,True,1430,
JOE,St. Joe Company (The) Common Stock,N,active,nasdaq,,,,"부동산 임대, 개발 및 운영",60101010.0,,,,US7901481009,True,9148,
JOF,Japan Smaller Capitalization Fund Inc Common Stock,N,active,nasdaq,,,,폐쇄형 펀드,55501030.0,,,,,True,9155,
JOUT,Johnson Outdoors Inc. - Class A Common Stock,Q,active,nasdaq,,,,오락용 제품,53205020.0,,,,US4791671088,True,9768,
JOYY,JOYY Inc. - American Depositary Shares,Q,active,nasdaq,,,,온라인 서비스,57201030.0,,,,,True,3435,
JPM,JP Morgan Chase & Co. Common Stock,N,active,nasdaq,,Financials,Diversified Banks,은행,55101010.0,"New York City, New York",19617.0,2000 (1799 / 1871),US46625H1005,True,11681,
JQC,Nuveen Credit Strategies Income Fund Shares of Beneficial Interest,N,active,nasdaq,,,,폐쇄형 펀드,55501030.0,,,,,True,5804,
JRI,Nuveen Real Asset Income and Growth Fund Common Shares of Beneficial Interest,N,active,nasdaq,,,,폐쇄형 펀드,55501030.0,,,,,True,3578,
JRS,Nuveen Real Estate Income Fund Common Shares of Beneficial Interest,N,active,nasdaq,,,,폐쇄형 펀드,55501030.0,,,,,True,6206,
JRSH,"Jerash Holdings (US), Inc. - Common Stock",Q,active,nasdaq,,,,직물 및 가죽제품,53202010.0,,,,US47632P1012,True,2064,
JRVR,"James River Group Holdings, Inc. - Common Stock",Q,active,nasdaq,,,,복합보험 및 중개인,55301010.0,,,,BMG5005R1079,True,2917,
JSM,"Navient Corporation - 6% Senior Notes due December 15, 2043",Q,active,nasdaq,,,,소비자 대출,55101030.0,,,,,True,5674,
JSPR,"Jasper Therapeutics, Inc. - Class A Common Stock",Q,active,nasdaq,,,,생명 공학 및 의학 연구,56202010.0,,,,,True,1640,
JTAI,Jet.AI Inc. - Common Stock,Q,active,nasdaq,,,,소프트웨어,57201020.0,,,,,True,1205,
JUNS,"Jupiter Neurosciences, Inc. - Common Stock",Q,active,nasdaq,,,,생명 공학 및 의학 연구,56202010.0,,,,,True,408,
JVA,"Coffee Holding Co., Inc. - Common Stock",Q,active,nasdaq,,,,식품 가공,54102020.0,,,,US1921761052,True,5338,
JWEL,Jowell Global Ltd. - Ordinary Shares,Q,active,nasdaq,,,,백화점,53402010.0,,,,,True,1342,
JXG,JX Luxventure Group Inc. - Common Stock,Q,active,nasdaq,,,,다각적 산업용 제품 도매,52202010.0,,,,,True,3364,
JXN,Jackson Financial Inc. Class A Common Stock ,N,active,nasdaq,,,,복합보험 및 중개인,55301010.0,,,,,True,1226,
JYD,Jayud Global Logistics Limited - Class A Ordinary Shares,Q,active,nasdaq,,,,"배달, 우편, 항공 화물 및 육상 물류",52405010.0,,,,,True,815,
JYNT,The Joint Corp. - Common Stock,Q,active,nasdaq,,,,의료 시설 및 서비스,56102010.0,,,,,True,2938,
JZ,Jianzhi Education Technology Group Company Limited - American Depositary Shares,Q,active,nasdaq,,,,IT 서비스 및 컨설팅,57201010.0,,,,,True,978,
JZXN,"Jiuzi Holdings, Inc. - Ordinary Shares",Q,active,nasdaq,,,,"자동차, 트럭 및 오토바이 부품",53101020.0,,,,,True,1300,
KAI,Kadant Inc Common Stock,N,active,nasdaq,,,,산업용 기계 및 장비,52102010.0,,,,US48282T1043,True,8486,
KALA,"KALA BIO, Inc. - Common Stock",Q,active,nasdaq,,,,생명 공학 및 의학 연구,56202010.0,,,,US4831191030,True,2263,
KALU,Kaiser Aluminum Corporation - Common Stock,Q,active,nasdaq,,,,알루미늄,51201030.0,,,,US4830077040,True,5041,
KAPA,"Kairos Pharma, Ltd. Common Stock",A,active,nasdaq,,,,생명 공학 및 의학 연구,56202010.0,,,,,True,463,
KARD,"Kardigan, Inc. - Common Stock",Q,active,nasdaq,,,,생명 공학 및 의학 연구,56202010.0,,,,,True,23,
KARO,Karooooo Ltd. - Ordinary shares,Q,active,nasdaq,,,,IT 서비스 및 컨설팅,57201010.0,,,,,True,1332,
KAZR,Skyline Builders Group Holding Limited - Class A Ordinary Shares,Q,active,nasdaq,,,,건설 및 엔지니어링,52201020.0,,,,,True,356,
KB,KB Financial Group Inc,N,active,nasdaq,,,,은행,55101010.0,,,,US48241A1051,True,6210,
KBDC,"Kayne Anderson BDC, Inc. Common Stock",N,active,nasdaq,,,,폐쇄형 펀드,55501030.0,,,,,True,542,
KBH,KB Home Common Stock,N,active,nasdaq,,,,주택 건설,53203010.0,,,,US48666K1097,True,10069,
KBON,Karbon Capital Partners Corp. - Class A Ordinary Shares,Q,active,nasdaq,,,,투자 지주 회사,55601010.0,,,,,True,121,
KBR,"KBR, Inc. Common Stock",N,active,nasdaq,,,,IT 서비스 및 컨설팅,57201010.0,,,,US48242W1062,True,4948,
KBSX,FST Corp. - Ordinary Shares,Q,active,nasdaq,,,,철 및 강철,51201020.0,,,,,True,1088,
KC,Kingsoft Cloud Holdings Limited - American Depositary Shares,Q,active,nasdaq,,,,IT 서비스 및 컨설팅,57201010.0,,,,,True,1558,
KCHV,Kochav Defense Acquisition Corp. - Class A Ordinary Shares,Q,active,nasdaq,,,,투자 지주 회사,55601010.0,,,,,True,252,
KCHVR,Kochav Defense Acquisition Corp. - Right,Q,unavailable,nasdaq,,,,투자 지주 회사,55601010.0,,,,,False,0,
KD,"Kyndryl Holdings, Inc. Common Stock",N,active,nasdaq,,,,IT 서비스 및 컨설팅,57201010.0,,,,,True,1190,
KDK,"Kodiak AI, Inc. - Common Stock",Q,active,nasdaq,,,,IT 서비스 및 컨설팅,57201010.0,,,,,True,206,
KDP,Keurig Dr Pepper Inc. - Common Stock,Q,active,nasdaq,,Consumer Staples,Soft Drinks & Non-alcoholic Beverages,무알콜 음료,54101030.0,"Burlington, Massachusetts",1418135.0,1981,US49271V1008,True,4473,
KE,"Kimball Electronics, Inc. - Common Stock",Q,active,nasdaq,,,,반도체,57101010.0,,,,US49428J1097,True,2945,
KEEL,Keel Infrastructure Corp. - Common Stock,Q,active,nasdaq,,,,블록 체인 및 암호화폐,57301030.0,,,,,True,1741,
KELYA,"Kelly Services, Inc. - Class A Common Stock",Q,active,nasdaq,,,,고용 서비스,52203030.0,,,,US4881522084,True,11681,
KELYB,"Kelly Services, Inc. - Class B Common Stock",Q,active,nasdaq,,,,고용 서비스,52203030.0,,,,US4881523074,True,10571,
KEN,Kenon Holdings Ltd. Ordinary Shares,N,active,nasdaq,,,,전력 유틸리티,59101010.0,,,,,True,2895,
KEP,Korea Electric Power Corporation Common Stock,N,active,nasdaq,,,,전력 유틸리티,59101010.0,,,,US5006311063,True,7985,
KEQU,Kewaunee Scientific Corporation - Common Stock,Q,active,nasdaq,,,,비즈니스 지원 용품,52203060.0,,,,US4928541048,True,11681,
KEX,Kirby Corporation Common Stock,N,active,nasdaq,,,,해양 화물 및 물류,52405020.0,,,,US4972661064,True,11681,
KEY,KeyCorp Common Stock,N,active,nasdaq,,Financials,Regional Banks,은행,55101010.0,"Cleveland, Ohio",91576.0,1825,US4932671088,True,9749,
KEYS,Keysight Technologies Inc. Common Stock,N,active,nasdaq,,Information Technology,Electronic Equipment & Instruments,산업용 기계 및 장비,52102010.0,"Santa Rosa, California",1601046.0,2014 (1939),US49338L1035,True,2848,
KEYY,Keystone Acquisition Corp. - Class A Ordinary Shares,Q,active,nasdaq,,,,투자 지주 회사,55601010.0,,,,,True,21,
KF,"Korea Fund, Inc. (The) New Common Stock",N,active,nasdaq,,,,폐쇄형 펀드,55501030.0,,,,,True,10559,
KFFB,Kentucky First Federal Bancorp - Common Stock,Q,active,nasdaq,,,,은행,55101010.0,,,,US4912921081,True,5379,
KFII,K&F Growth Acquisition Corp. II - Class A Ordinary shares,Q,active,nasdaq,,,,투자 지주 회사,55601010.0,,,,,True,340,
KFIIR,K&F Growth Acquisition Corp. II - Rights,Q,unavailable,nasdaq,,,,투자 지주 회사,55601010.0,,,,,False,0,
KFRC,"Kforce, Inc. Common Stock",N,active,nasdaq,,,,고용 서비스,52203030.0,,,,US4937321010,True,7784,
KFY,Korn Ferry Common Stock,N,active,nasdaq,,,,고용 서비스,52203030.0,,,,US5006432000,True,6902,
KG,"Kestrel Group, Ltd. - Common Stock",Q,active,nasdaq,,,,복합보험 및 중개인,55301010.0,,,,,True,4581,
KGC,Kinross Gold Corporation Common Stock,N,active,nasdaq,,,,금,51201060.0,,,,CA4969024047,True,11429,
KGEI,Kolibri Global Energy Inc. - Common stock,Q,active,nasdaq,,,,"오일, 가스 탐사 및 생산",50102020.0,,,,,True,4161,
KGS,"Kodiak Gas Services, Inc. Common Stock",N,active,nasdaq,,,,오일 관련 서비스 및 장비,50103020.0,,,,,True,768,
KHC,The Kraft Heinz Company - Common Stock,Q,active,nasdaq,,Consumer Staples,Packaged Foods & Meats,식품 가공,54102020.0,"Chicago, Illinois; Pittsburgh, Pennsylvania",1637459.0,2015 (1869),US5007541064,True,2671,
KIDS,OrthoPediatrics Corp. - Common Stock,Q,active,nasdaq,,,,"의료 장비, 물품 및 유통",56101020.0,,,,,True,2203,
KIDZ,KIDZ AI Inc. - Class B Common Stock,Q,active,nasdaq,,,,소프트웨어,57201020.0,,,,,True,324,
KIM,Kimco Realty Corporation (HC) Common Stock,N,active,nasdaq,,Real Estate,Retail REITs,상업용 REITs,60102020.0,"Jericho, New York",879101.0,1958,US49446R1095,True,8725,
KINS,"Kingstone Companies, Inc - Common Stock",Q,active,nasdaq,,,,손해보험,55301020.0,,,,US4967191051,True,6724,
KIO,KKR Income Opportunities Fund Common Shares,N,active,nasdaq,,,,폐쇄형 펀드,55501030.0,,,,,True,3266,
KITT,"Nauticus Robotics, Inc. - Common stock",Q,active,nasdaq,,,,산업용 기계 및 장비,52102010.0,,,,,True,1246,
KKR,KKR & Co. Inc. Common Stock,N,active,nasdaq,,Financials,Asset Management & Custody Banks,투자 관리 및 펀드 운영,55102020.0,"New York City, New York",1404912.0,1976,US48251W1045,True,3922,
KKRS,KKR Group Finance Co. IX LLC 4.625% Subordinated Notes due 2061,N,active,nasdaq,,,,,,,,,,True,1319,
KKRT,KKR & Co. Inc. 6.875% Subordinated Notes due 2065,N,active,nasdaq,,,,,,,,,,True,287,
KLAC,KLA Corporation  - Common Stock,Q,active,nasdaq,,Information Technology,Semiconductor Materials & Equipment,반도체 장비 및 테스트,57101020.0,"Milpitas, California",319201.0,1975/1977 (1997),US4824801009,True,11538,
KLAR,Klarna Group plc Ordinary Shares,N,active,nasdaq,,,,소프트웨어,57201020.0,,,,,True,216,
KLC,"KinderCare Learning Companies, Inc. Common Stock",N,active,nasdaq,,,,개인 서비스,54201030.0,,,,,True,446,
KLIC,"Kulicke and Soffa Industries, Inc. - Common Stock",Q,active,nasdaq,,,,반도체 장비 및 테스트,57101020.0,,,,US5012421013,True,13467,
KLRA,"Kailera Therapeutics, Inc. - Common stock",Q,active,nasdaq,,,,제약,56201040.0,,,,,True,66,
KLRS,"Kalaris Therapeutics, Inc.  - Common Stock",Q,active,nasdaq,,,,생명 공학 및 의학 연구,56202010.0,,,,,True,1501,
KLTR,"Kaltura, Inc. - Common Stock",Q,active,nasdaq,,,,소프트웨어,57201020.0,,,,,True,1256,
KLXE,"KLX Energy Services Holdings, Inc.  - Common Stock",Q,active,nasdaq,,,,오일 관련 서비스 및 장비,50103020.0,,,,US48253L1061,True,1983,
KMB,Kimberly-Clark Corporation - Common Stock,Q,active,nasdaq,,Consumer Staples,Household Products,개인 생활 필수 용품,54201020.0,"Irving, Texas",55785.0,1872,US4943681035,True,11681,
KMDA,Kamada Ltd. - Ordinary Shares,Q,active,nasdaq,,,,제약,56201040.0,,,,,True,3305,
KMI,"Kinder Morgan, Inc. Common Stock",N,active,nasdaq,,Energy,Oil & Gas Storage & Transportation,오일 및 가스 수송 서비스,50103030.0,"Houston, Texas",1506307.0,1997,US49456B1017,True,3775,
KMPB,Kemper Corporation 5.875% Fixed-Rate Reset Junior Subordinated Debentures due 2062,N,active,nasdaq,,,,손해보험,55301020.0,,,,,True,1091,
KMPR,Kemper Corporation,N,active,nasdaq,,,,손해보험,55301020.0,,,,US4884011002,True,9128,
KMRK,K-Tech Solutions Company Limited - Class A Ordinary Shares,Q,active,nasdaq,,,,장난감 및 어린이 제품,53205010.0,,,,,True,256,
KMT,Kennametal Inc. Common Stock,N,active,nasdaq,,,,산업용 기계 및 장비,52102010.0,,,,US4891701009,True,13467,
KMTS,"Kestra Medical Technologies, Ltd. - Common Stock",Q,active,nasdaq,,,,첨단 의료 장비 및 기술,56101010.0,,,,,True,346,
KMX,CarMax Inc,N,active,nasdaq,,,,"자동차 차량, 부품 및 서비스 소매",53403010.0,,,,US1431301027,True,7411,
KN,Knowles Corporation Common Stock,N,active,nasdaq,,,,전자 장비 및 부품,57104010.0,,,,US49926D1090,True,3126,
KNDI,"Kandi Technologies Group, Inc. - Ordinary Shares",Q,active,nasdaq,,,,자동차 및 트럭 제조,53101010.0,,,,US4837091010,True,4750,
KNF,Knife Riv Holding Co. Common Stock,N,active,nasdaq,,,,건설 자재,51202010.0,,,,,True,784,
KNRX,KNOREX LTD. Class A Ordinary Shares,A,active,nasdaq,,,,IT 서비스 및 컨설팅,57201010.0,,,,,True,204,
KNSA,"Kiniksa Pharmaceuticals International, plc - Class A Ordinary Shares",Q,active,nasdaq,,,,제약,56201040.0,,,,BMG5269C1010,True,2049,
KNSL,"Kinsale Capital Group, Inc. Common Stock",N,active,nasdaq,,,,손해보험,55301020.0,,,,US49714P1084,True,2509,
KNTK,Kinetik Holdings Inc. Class A Common Stock,N,active,nasdaq,,,,오일 및 가스 수송 서비스,50103030.0,,,,,True,1930,
KNX,Knight-Swift Transportation Holdings Inc.,N,active,nasdaq,,,,지상 화물 및 물류,52405030.0,,,,US4990491049,True,7987,
KO,Coca-Cola Company (The) Common Stock,N,active,nasdaq,,Consumer Staples,Soft Drinks & Non-alcoholic Beverages,무알콜 음료,54101030.0,"Atlanta, Georgia",21344.0,1886,US1912161007,True,16246,
KOD,Kodiak Sciences Inc - Common Stock,Q,active,nasdaq,,,,생명 공학 및 의학 연구,56202010.0,,,,,True,1958,
KODK,Eastman Kodak Company Common New,N,active,nasdaq,,,,사무기기,57105010.0,,,,,True,3226,
KOP,Koppers Holdings Inc. Common Stock,N,active,nasdaq,,,,상품 화학,51101010.0,,,,US50060P1066,True,5149,
KOPN,Kopin Corporation - Common Stock,Q,active,nasdaq,,,,반도체,57101010.0,,,,US5006001011,True,8626,
KOS,Kosmos Energy Ltd. Common Shares (DE),N,active,nasdaq,,,,"오일, 가스 탐사 및 생산",50102020.0,,,,US5006881065,True,3821,
KOSS,Koss Corporation - Common Stock,Q,active,nasdaq,,,,가정용 전자 제품,57106030.0,,,,US5006921085,True,11681,
KOYN,CSLM Digital Asset Acquisition Corp III - Class A Ordinary Shares,Q,active,nasdaq,,,,투자 지주 회사,55601010.0,,,,,True,209,
KPET,KPET Ultra Paceline Corporation Class A Ordinary Shares,N,active,nasdaq,,,,투자 지주 회사,55601010.0,,,,,True,40,
KPLT,"Katapult Holdings, Inc. - Common Stock",Q,active,nasdaq,,,,소프트웨어,57201020.0,,,,,True,1647,
KPRX,"Kiora Pharmaceuticals, Inc.  - Common Stock",Q,active,nasdaq,,,,생명 공학 및 의학 연구,56202010.0,,,,,True,2874,
KPTI,Karyopharm Therapeutics Inc. - Common Stock,Q,active,nasdaq,,,,제약,56201040.0,,,,US48576U1060,True,3194,
KR,Kroger Company (The) Common Stock,N,active,nasdaq,,Consumer Staples,Food Retail,식품 소매 및 유통,54301020.0,"Cincinnati, Ohio",56873.0,1883,US5010441013,True,16246,
KRAQ,KRAKacquisition Corp - Class A Ordinary Shares,Q,active,nasdaq,,,,투자 지주 회사,55601010.0,,,,,True,84,
KRC,Kilroy Realty Corporation Common Stock,N,active,nasdaq,,,,상업용 REITs,60102020.0,,,,US49427F1084,True,7415,
KREF,KKR Real Estate Finance Trust Inc. Common Stock,N,active,nasdaq,,,,특수 REITs,60102040.0,,,,,True,2315,
KRG,Kite Realty Group Trust Common Stock,N,active,nasdaq,,,,상업용 REITs,60102020.0,,,,US49803T3005,True,5520,
KRKR,36Kr Holdings Inc. - American Depositary Shares,Q,active,nasdaq,,,,온라인 서비스,57201030.0,,,,,True,1681,
KRMD,"KORU Medical Systems, Inc. - Common Stock",Q,active,nasdaq,,,,"의료 장비, 물품 및 유통",56101020.0,,,,,True,8128,
KRMN,Karman Holdings Inc. Common Stock,N,active,nasdaq,,,,항공우주 및 방위,52101010.0,,,,,True,360,
KRNT,Kornit Digital Ltd. - Ordinary Shares,Q,active,nasdaq,,,,산업용 기계 및 장비,52102010.0,,,,IL0011216723,True,2842,
KRNY,Kearny Financial - Common Stock,Q,active,nasdaq,,,,은행,55101010.0,,,,US48716P1084,True,5385,
KRO,Kronos Worldwide Inc Common Stock,N,active,nasdaq,,,,상품 화학,51101010.0,,,,US50105F1057,True,5689,
KROS,"Keros Therapeutics, Inc. - common stock",Q,active,nasdaq,,,,생명 공학 및 의학 연구,56202010.0,,,,,True,1579,
KRRO,"Korro Bio, Inc. - Common Stock",Q,active,nasdaq,,,,생명 공학 및 의학 연구,56202010.0,,,,,True,1708,
KRSP,Rice Acquisition Corporation 3 Class A Ordinary Shares,N,active,nasdaq,,,,투자 지주 회사,55601010.0,,,,,True,163,
KRT,Karat Packaging Inc. - Common Stock,Q,active,nasdaq,,,,용기(종이 제외) 및 포장재,51302010.0,,,,,True,1323,
KRUS,"Kura Sushi USA, Inc. - Class A Common Stock",Q,active,nasdaq,,,,레스토랑 및 바,53301020.0,,,,US5012701026,True,1752,
KRYS,"Krystal Biotech, Inc. - Common Stock",Q,active,nasdaq,,,,제약,56201040.0,,,,,True,2220,
KSCP,"Knightscope, Inc. - Class A Common Stock",Q,active,nasdaq,,,,통신 및 네트워킹,57102010.0,,,,,True,1124,
KSPI,Joint Stock Company Kaspi.kz - American Depository Shares,Q,active,nasdaq,,,,핀테크,57301010.0,,,,,True,628,
KSS,Kohl's Corporation Common Stock,N,active,nasdaq,,,,백화점,53402010.0,,,,US5002551043,True,8603,
KT,KT Corporation Common Stock,N,active,nasdaq,,,,통합 통신 서비스,57401010.0,,,,,True,6830,
KTB,"Kontoor Brands, Inc. Common Stock ",N,active,nasdaq,,,,의류 및 액세서리,53202020.0,,,,US50050N1037,True,1798,
KTCC,Key Tronic Corporation - Common Stock,Q,active,nasdaq,,,,전자 장비 및 부품,57104010.0,,,,US4931441095,True,10855,
KTF,DWS Municipal Income Trust,N,active,nasdaq,,,,폐쇄형 펀드,55501030.0,,,,,True,9505,
KTN,Structured Products Corp 8.205% CorTS 8.205% Corporate Backed Trust Securities (CorTS),N,active,nasdaq,,,,기업 금융 서비스,55101050.0,,,,,True,5692,
KTOS,"Kratos Defense & Security Solutions, Inc. - Common Stock",Q,active,nasdaq,,,,항공우주 및 방위,52101010.0,,,,US50077B2079,True,6716,
KTTA,Pasithea Therapeutics Corp. - Common Stock,Q,active,nasdaq,,,,생명 공학 및 의학 연구,56202010.0,,,,,True,1217,
KTWO,K2 Capital Acquisition Corporation - Class A Ordinary Share,Q,active,nasdaq,,,,투자 지주 회사,55601010.0,,,,,True,101,
KTWOR,K2 Capital Acquisition Corporation - Rights,Q,unavailable,nasdaq,,,,,,,,,,False,0,
KULR,"KULR Technology Group, Inc. Common Stock",A,active,nasdaq,,,,전기 부품 및 장비,52102030.0,,,,,True,2012,
KURA,"Kura Oncology, Inc. - Common Stock",Q,active,nasdaq,,,,생명 공학 및 의학 연구,56202010.0,,,,US50127T1097,True,2727,
KUST,"Kustom Entertainment, Inc. - Common Stock",Q,active,nasdaq,,,,경영 지원 서비스,52203040.0,,,,,True,4826,
KVAC,Keen Vision Acquisition Corporation - Ordinary Shares,Q,active,nasdaq,,,,투자 지주 회사,55601010.0,,,,,True,714,
KVHI,"KVH Industries, Inc. - Common Stock",Q,active,nasdaq,,,,통신 및 네트워킹,57102010.0,,,,US4827381017,True,7624,
KVUE,Kenvue Inc. Common Stock,N,active,nasdaq,,Consumer Staples,Personal Care Products,개인 생활 필수 용품,54201020.0,"Skillman, New Jersey",1944048.0,2022 (Johnson & Johnson spinoff),,True,699,
KVYO,"Klaviyo, Inc. Series A Common Stock",N,active,nasdaq,,,,소프트웨어,57201020.0,,,,,True,711,
KWM,"K Wave Media, Ltd. - Ordinary Shares",Q,active,nasdaq,,,,엔터테인먼트 제작,53302030.0,,,,,True,298,
KWR,Quaker Houghton Common Stock,N,active,nasdaq,,,,상품 화학,51101010.0,,,,US7473161070,True,11681,
KWY,Kingsway Corporation Common Stock,N,active,nasdaq,,,,손해보험,55301020.0,,,,,True,6294,
KXIN,Kaixin Holdings - Ordinary Shares,Q,active,nasdaq,,,,"자동차 차량, 부품 및 서비스 소매",53403010.0,,,,KYG5223X1007,True,2187,
KYIV,Kyivstar Group Ltd. - Common Shares,Q,active,nasdaq,,,,통합 통신 서비스,57401010.0,,,,,True,408,
KYMR,"Kymera Therapeutics, Inc. - Common Stock",Q,active,nasdaq,,,,생명 공학 및 의학 연구,56202010.0,,,,,True,1485,
KYN,"Kayne Anderson Energy Infrastructure Fund, Inc.",N,active,nasdaq,,,,폐쇄형 펀드,55501030.0,,,,,True,5488,
KYNB,"Kyntra Bio, Inc. - Common Stock",Q,active,nasdaq,,,,제약,56201040.0,,,,,True,2936,
KYTX,"Kyverna Therapeutics, Inc. - Common Stock",Q,active,nasdaq,,,,생명 공학 및 의학 연구,56202010.0,,,,,True,613,
KZIA,Kazia Therapeutics Limited - American Depositary Shares,Q,active,nasdaq,,,,생명 공학 및 의학 연구,56202010.0,,,,US48669G1058,True,6927,
L,Loews Corporation Common Stock,N,active,nasdaq,,Financials,Multi-line Insurance,손해보험,55301020.0,"New York City, New York",60086.0,1959,US5404241086,True,11681,
LAB,Standard BioTools Inc. - Common Stock,Q,active,nasdaq,,,,첨단 의료 장비 및 기술,56101010.0,,,,,True,3883,
LABT,Lakewood-Amedex Biotherapeutics Inc. - Common Stock,Q,active,nasdaq,,,,생명 공학 및 의학 연구,56202010.0,,,,,True,62,
LAC,Lithium Americas Corp. Common Shares,N,active,nasdaq,,,,특수 채굴 및 금속,51201050.0,,,,,True,703,
LAD,"Lithia Motors, Inc. Common Stock",N,active,nasdaq,,,,"자동차 차량, 부품 및 서비스 소매",53403010.0,,,,US5367971034,True,7443,
LADR,Ladder Capital Corp Class A Common Stock,N,active,nasdaq,,,,특수 REITs,60102040.0,,,,,True,3132,
LAES,SEALSQ Corp - Ordinary Shares,Q,active,nasdaq,,,,반도체,57101010.0,,,,,True,793,
LAFA,LaFayette Acquisition Corp. - Ordinary Share,Q,active,nasdaq,,,,투자 지주 회사,55601010.0,,,,,True,161,
LAFAR,LaFayette Acquisition Corp. - Rights,Q,active,nasdaq,,,,투자 지주 회사,55601010.0,,,,,True,161,
LAKE,"Lakeland Industries, Inc. - Common Stock",Q,active,nasdaq,,,,의류 및 액세서리,53202020.0,,,,US5117951062,True,10043,
LAMR,Lamar Advertising Company - Class A Common Stock,Q,active,nasdaq,,,,특수 REITs,60102040.0,,,,US5128161099,True,7539,
LAND,Gladstone Land Corporation - Common Stock,Q,active,nasdaq,,,,특수 REITs,60102040.0,,,,US3765491010,True,3390,
LANV,Lanvin Group Holdings Limited Ordinary Shares,N,active,nasdaq,,,,의류 및 액세서리 소매,53403040.0,,,,,True,1345,
LAR,Lithium Argentina AG Common Shares,N,active,nasdaq,,,,특수 채굴 및 금속,51201050.0,,,,,True,4487,
LARK,Landmark Bancorp Inc. - Common Stock,Q,active,nasdaq,,,,은행,55101010.0,,,,US51504L1070,True,8133,
LASE,Laser Photonics Corporation - Common Stock,Q,active,nasdaq,,,,전기 부품 및 장비,52102030.0,,,,,True,954,
LASR,"nLIGHT, Inc. - Common Stock",Q,active,nasdaq,,,,반도체,57101010.0,,,,US65487K1007,True,2070,
LATA,Galata Acquisition Corp. II - Class A Ordinary Shares,Q,active,nasdaq,,,,투자 지주 회사,55601010.0,,,,,True,173,
LAUR,"Laureate Education, Inc. - Common Stock",Q,active,nasdaq,,,,기타 교육 서비스 제공,63101010.0,,,,US5186132032,True,2380,
LAW,"CS Disco, Inc. Common Stock",N,active,nasdaq,,,,소프트웨어,57201020.0,,,,,True,1256,
LAWR,"Robot Consulting Co., Ltd. - ADS",Q,active,nasdaq,,,,소프트웨어,57201020.0,,,,,True,254,
LAZ,"Lazard, Inc. Common Stock",N,active,nasdaq,,,,투자 관리 및 펀드 운영,55102020.0,,,,BMG540501027,True,5336,
LB,LandBridge Company LLC Class A Shares Representing Limited Liability Company Interests,N,active,nasdaq,,,,"오일, 가스 탐사 및 생산",50102020.0,,,,US5017971046,True,517,
LBGJ,Li Bang International Corporation Inc. - Class A Ordinary Shares,Q,active,nasdaq,,,,산업용 기계 및 장비,52102010.0,,,,,True,436,
LBRDA,Liberty Broadband Corporation - Class A Common Stock,Q,active,nasdaq,,,,방송,53302020.0,,,,US5303071071,True,2944,
LBRDK,Liberty Broadband Corporation - Class C Common Stock,Q,active,nasdaq,,,,방송,53302020.0,,,,US5303073051,True,2943,
LBRT,Liberty Energy Inc. Class A common stock,N,active,nasdaq,,,,오일 관련 서비스 및 장비,50103020.0,,,,,True,2142,
LBRX,LB Pharmaceuticals Inc - Common Stock,Q,active,nasdaq,,,,생명 공학 및 의학 연구,56202010.0,,,,,True,216,
LBTYA,Liberty Global Ltd. - Class A Common Shares,Q,active,nasdaq,,,,방송,53302020.0,,,,GB00B8W67662,True,5568,
LBTYB,Liberty Global Ltd. - Class B Common Shares,Q,active,nasdaq,,,,방송,53302020.0,,,,GB00B8W67779,True,5563,
LBTYK,Liberty Global Ltd. - Class C Common Shares,Q,active,nasdaq,,,,방송,53302020.0,,,,GB00B8W67B19,True,5249,
LCCC,Lakeshore Acquisition III Corp. - Ordinary Shares,Q,active,nasdaq,,,,투자 지주 회사,55601010.0,,,,,True,271,
LCCCR,Lakeshore Acquisition III Corp. - Rights,Q,unavailable,nasdaq,,,,투자 지주 회사,55601010.0,,,,,False,0,
LCFY,Locafy Limited - Ordinary Share,Q,active,nasdaq,,,,소프트웨어,57201020.0,,,,,True,1084,
LCID,"Lucid Group, Inc. - Common Stock",Q,active,nasdaq,,,,자동차 및 트럭 제조,53101010.0,,,,,True,1466,
LCII,LCI Industries,N,active,nasdaq,,,,"자동차, 트럭 및 오토바이 부품",53101020.0,,,,US50189K1034,True,10366,
LCLN,"Lincoln International, Inc. Class A Common Stock",N,active,nasdaq,,,,투자 관리 및 펀드 운영,55102020.0,,,,,True,43,
LCNB,LCNB Corporation - Common Stock,Q,active,nasdaq,,,,은행,55101010.0,,,,US50181P1003,True,6724,
LCTX,"Lineage Cell Therapeutics, Inc. Common Stock",A,active,nasdaq,,,,생명 공학 및 의학 연구,56202010.0,,,,US53566P1093,True,8655,
LCUT,"Lifetime Brands, Inc. - Common Stock",Q,active,nasdaq,,,,"가전제품, 도구 및 가정 용품",53204030.0,,,,US53222Q1031,True,8845,
LDI,"loanDepot, Inc. Class A Common Stock",N,active,nasdaq,,,,소비자 대출,55101030.0,,,,,True,1366,
LDOS,"Leidos Holdings, Inc. Common Stock",N,active,nasdaq,,Industrials,Diversified Support Services,IT 서비스 및 컨설팅,57201010.0,"Reston, Virginia",1336920.0,1969,US5253271028,True,4863,
LE,"Lands' End, Inc. - Common Stock",Q,active,nasdaq,,,,의류 및 액세서리 소매,53403040.0,,,,US51509F1057,True,3103,
LEA,Lear Corporation Common Stock,N,active,nasdaq,,,,"자동차, 트럭 및 오토바이 부품",53101020.0,,,,US5218652049,True,4199,
