symbol,name,exchange,status,source,security_type,sector,industry_gics,industry_fdr,industry_code,headquarters,cik,founded,isin,has_price_csv,downloaded_rows,effective_date
POWL,"Powell Industries, Inc. - Common Stock",Q,active,nasdaq,,,,전기 부품 및 장비,52102030.0,,,,US7391281067,True,11681,
POWW,Outdoor Holding Company - Common Stock,Q,active,nasdaq,,,,오락용 제품,53205020.0,,,,,True,2376,
PPBT,Purple Biotech Ltd. - American Depositary Shares,Q,active,nasdaq,,,,생명 공학 및 의학 연구,56202010.0,,,,,True,2680,
PPC,Pilgrim's Pride Corporation - Common Stock,Q,active,nasdaq,,,,식품 가공,54102020.0,,,,US72147K1088,True,9712,
PPCB,"Propanc Biopharma, Inc. - Common Stock",Q,active,nasdaq,,,,생명 공학 및 의학 연구,56202010.0,,,,,True,3405,
PPG,"PPG Industries, Inc. Common Stock",N,active,nasdaq,,Materials,Specialty Chemicals,상품 화학,51101010.0,"Pittsburgh, Pennsylvania",79879.0,1883,US6935061076,True,11681,
PPHC,"Public Policy Holding Company, Inc. - Common Stock",Q,active,nasdaq,,,,광고 및 마케팅,53302010.0,,,,,True,121,
PPIH,"Perma-Pipe International Holdings, Inc. - Common Stock",Q,active,nasdaq,,,,철 및 강철,51201020.0,,,,US7141671039,True,9215,
PPL,PPL Corporation Common Stock,N,active,nasdaq,,Utilities,Electric Utilities,복합 유틸리티,59104010.0,"Allentown, Pennsylvania",922224.0,1920,US69351T1060,True,11681,
PPLI,People Incorporated - Common Stock,Q,active,nasdaq,,,,온라인 서비스,57201030.0,,,,,True,8434,
PPSI,"Pioneer Power Solutions, Inc. - Common Stock",Q,active,nasdaq,,,,중전기장비,52102040.0,,,,US7238363003,True,3324,
PPT,Franklin Premier Income Trust Shares of Beneficial Interest,N,active,nasdaq,,,,투자 관리 및 펀드 운영,55102020.0,,,,,True,9677,
PPTA,Perpetua Resources Corp. - Common Shares,Q,active,nasdaq,,,,금,51201060.0,,,,,True,1362,
PR,Permian Resources Corporation Class A Common Stock,N,active,nasdaq,,,,"오일, 가스 탐사 및 생산",50102020.0,,,,,True,2581,
PRAA,"PRA Group, Inc. - Common Stock",Q,active,nasdaq,,,,기업 금융 서비스,55101050.0,,,,US69354N1063,True,5961,
PRAX,"Praxis Precision Medicines, Inc. - Common Stock",Q,active,nasdaq,,,,생명 공학 및 의학 연구,56202010.0,,,,,True,1446,
PRCH,"Porch Group, Inc. - Common Stock",Q,active,nasdaq,,,,소프트웨어,57201020.0,,,,,True,1639,
PRCT,PROCEPT BioRobotics Corporation - Common Stock,Q,active,nasdaq,,,,"의료 장비, 물품 및 유통",56101020.0,,,,,True,1217,
PRDO,Perdoceo Education Corporation - Common Stock,Q,active,nasdaq,,,,기타 교육 서비스 제공,63101010.0,,,,,True,7163,
PRE,Prenetics Global Limited - Class A Ordinary Share,Q,active,nasdaq,,,,"의료 장비, 물품 및 유통",56101020.0,,,,,True,1259,
PRFX,PRF Technologies Ltd. - Ordinary Shares,Q,active,nasdaq,,,,제약,56201040.0,,,,,True,1478,
PRG,"PROG Holdings, Inc. Common Stock",N,active,nasdaq,,,,핀테크,57301010.0,,,,,True,11014,
PRGO,Perrigo Company plc Ordinary Shares,N,active,nasdaq,,,,제약,56201040.0,,,,IE00BGH1M568,True,8709,
PRGS,Progress Software Corporation - Common Stock,Q,active,nasdaq,,,,소프트웨어,57201020.0,,,,US7433121008,True,8807,
PRH,"Prudential Financial, Inc. 5.950% Junior Subordinated Notes due 2062",N,active,nasdaq,,,,,,,,,,True,982,
PRHI,"Presurance Holdings, Inc. - Common Stock",Q,active,nasdaq,,,,손해보험,55301020.0,,,,,True,2749,
PRHIZ,"Presurance Holdings, Inc. - 9.75% Senior Unsecured Notes due 2028",Q,active,nasdaq,,,,손해보험,55301020.0,,,,,True,211,
PRI,"Primerica, Inc. Common Stock",N,active,nasdaq,,,,생명 및 건강 보험,55301030.0,,,,US74164M1080,True,4101,
PRIM,Primoris Services Corporation Common Stock,N,active,nasdaq,,,,건설 및 엔지니어링,52201020.0,,,,US74164F1030,True,4517,
PRK,Park National Corporation Common Stock,A,active,nasdaq,,,,은행,55101010.0,,,,US7006581075,True,9036,
PRKS,United Parks & Resorts Inc. Common Stock,N,active,nasdaq,,,,여가 및 오락시설,53301040.0,,,,,True,3334,
PRLB,"Proto Labs, Inc. Common stock",N,active,nasdaq,,,,산업용 기계 및 장비,52102010.0,,,,US7437131094,True,3622,
PRLD,Prelude Therapeutics Incorporated - Common Stock,Q,active,nasdaq,,,,생명 공학 및 의학 연구,56202010.0,,,,,True,1461,
PRM,"Perimeter Solutions, SA Common Stock",N,active,nasdaq,,,,특수 화학제,51101030.0,,,,,True,1178,
PRMB,Primo Brands Corporation Class A Common Stock,N,active,nasdaq,,,,무알콜 음료,54101030.0,,,,,True,8584,
PRME,"Prime Medicine, Inc. - Common Stock",Q,active,nasdaq,,,,생명 공학 및 의학 연구,56202010.0,,,,,True,940,
PROF,Profound Medical Corp. - common stock,Q,active,nasdaq,,,,첨단 의료 장비 및 기술,56101010.0,,,,,True,1690,
PROK,ProKidney Corp. - Class A Ordinary Shares,Q,active,nasdaq,,,,생명 공학 및 의학 연구,56202010.0,,,,,True,1270,
PROP,Prairie Operating Co. - Common Stock,Q,active,nasdaq,,,,"오일, 가스 탐사 및 생산",50102020.0,,,,,True,3376,
PROV,"Provident Financial Holdings, Inc. - Common Stock",Q,active,nasdaq,,,,은행,55101010.0,,,,US7438681014,True,7563,
PRPL,"Purple Innovation, Inc. - Common Stock",Q,active,nasdaq,,,,가정용 가구,53204040.0,,,,US74640Y1064,True,2696,
PRPO,"Precipio, Inc. - Common Stock",Q,active,nasdaq,,,,첨단 의료 장비 및 기술,56101010.0,,,,,True,2276,
PRQR,ProQR Therapeutics N.V. - Ordinary Shares,Q,active,nasdaq,,,,생명 공학 및 의학 연구,56202010.0,,,,NL0010872495,True,2977,
PRS,"Prudential Financial, Inc. 5.625% Junior Subordinated Notes due 2058",N,active,nasdaq,,,,,,,,,,True,1988,
PRSO,Peraso Inc. - Common Stock,Q,active,nasdaq,,,,반도체,57101010.0,,,,,True,6290,
PRSU,"Pursuit Attractions and Hospitality, Inc. Common Stock",N,active,nasdaq,,,,여가 및 오락시설,53301040.0,,,,,True,5556,
PRTA,Prothena Corporation plc - Ordinary Shares,Q,active,nasdaq,,,,생명 공학 및 의학 연구,56202010.0,,,,IE00B91XRN20,True,3414,
PRTH,"Priority Technology Holdings, Inc. - Common Stock",Q,active,nasdaq,,,,핀테크,57301010.0,,,,US74275G1076,True,2418,
PRTS,"CarParts.com, Inc. - Common Stock",Q,active,nasdaq,,,,"자동차 차량, 부품 및 서비스 소매",53403010.0,,,,US90343C1009,True,4892,
PRU,"Prudential Financial, Inc. Common Stock",N,active,nasdaq,,Financials,Life & Health Insurance,생명 및 건강 보험,55301030.0,"Newark, New Jersey",1137774.0,1875,US7443201022,True,6189,
PRVA,"Privia Health Group, Inc. - Common Stock",Q,active,nasdaq,,,,의료 시설 및 서비스,56102010.0,,,,,True,1314,
PRZO,ParaZero Technologies Ltd. - Ordinary Shares,Q,active,nasdaq,,,,항공우주 및 방위,52101010.0,,,,,True,749,
PS,Pershing Square Inc. Common Stock,N,active,nasdaq,,,,투자 관리 및 펀드 운영,55102020.0,,,,US72941B1061,True,58,
PSA,Public Storage Common Stock,N,active,nasdaq,,Real Estate,Self-Storage REITs,특수 REITs,60102040.0,"Glendale, California",1393311.0,1972,US74460D1090,True,11510,
PSBD,Palmer Square Capital BDC Inc. Common Stock,N,active,nasdaq,,,,폐쇄형 펀드,55501030.0,,,,,True,629,
PSEC,Prospect Capital Corporation - Closed End Fund,Q,active,nasdaq,,,,폐쇄형 펀드,55501030.0,,,,,True,5532,
PSFE,Paysafe Limited Common Shares,N,active,nasdaq,,,,핀테크,57301010.0,,,,,True,1451,
PSHG,Performance Shipping Inc. - Common Shares,Q,active,nasdaq,,,,오일 및 가스 수송 서비스,50103030.0,,,,,True,3910,
PSIG,PS International Group Ltd. - Ordinary Shares,Q,active,nasdaq,,,,"배달, 우편, 항공 화물 및 육상 물류",52405010.0,,,,,True,503,
PSIX,"Power Solutions International, Inc. - Common Stock",Q,active,nasdaq,,,,산업용 기계 및 장비,52102010.0,,,,,True,3586,
PSKY,Paramount Skydance Corporation - Class B Common Stock,Q,active,nasdaq,,Communication Services,Movies & Entertainment,엔터테인먼트 제작,53302030.0,"Los Angeles, California",2041610.0,2025 (Paramount Pictures 1912),,True,5081,
PSMT,"PriceSmart, Inc. - Common Stock",Q,active,nasdaq,,,,할인점,53402020.0,,,,US7415111092,True,7266,
PSN,Parsons Corporation Common Stock,N,active,nasdaq,,,,항공우주 및 방위,52101010.0,,,,,True,1811,
PSNL,"Personalis, Inc. - Common Stock",Q,active,nasdaq,,,,생명 공학 및 의학 연구,56202010.0,,,,,True,1781,
PSNY,Polestar Automotive Holding UK Limited - Class A ADS,Q,active,nasdaq,,,,자동차 및 트럭 제조,53101010.0,,,,,True,1300,
PSNYW,Polestar Automotive Holding UK Limited - Class C-1 ADS (ADW),Q,active,nasdaq,,,,자동차 및 트럭 제조,53101010.0,,,,,True,195,
PSO,"Pearson, Plc Common Stock",N,active,nasdaq,,,,소비자 출판,53302040.0,,,,US7050151056,True,7464,
PSQH,"PSQ Holdings, Inc. Class A Common Stock",N,active,nasdaq,,,,소프트웨어,57201020.0,,,,,True,1266,
PSTL,"Postal Realty Trust, Inc. Class A Common Stock",N,active,nasdaq,,,,상업용 REITs,60102020.0,,,,,True,1806,
PSTV,"PLUS THERAPEUTICS, Inc. - Common Stock",Q,active,nasdaq,,,,생명 공학 및 의학 연구,56202010.0,,,,US72941H4002,True,6294,
PSUS,"Pershing Square USA, Ltd. Common Shares",N,active,nasdaq,,,,폐쇄형 펀드,55501030.0,,,,,True,58,
PSX,Phillips 66 Common Stock,N,active,nasdaq,,Energy,Oil & Gas Refining & Marketing,"오일, 가스 정제 및 마케팅",50102030.0,"Houston, Texas",1534701.0,2012 (1917),US7185461040,True,3482,
PTAC,Patriot Acquisition Corp. - Class A Ordinary Shares,Q,active,nasdaq,,,,투자 지주 회사,55601010.0,,,,,True,12,
PTC,PTC Inc. - Common Stock,Q,active,nasdaq,,Information Technology,Application Software,소프트웨어,57201020.0,"Boston, Massachusetts",857005.0,1985,US69370C1009,True,9220,
PTCT,"PTC Therapeutics, Inc. - Common Stock",Q,active,nasdaq,,,,제약,56201040.0,,,,US69366J2006,True,3291,
PTEN,"Patterson-UTI Energy, Inc. - Common Stock",Q,active,nasdaq,,,,오일 및 가스 시추,50103010.0,,,,US7034811015,True,8234,
PTGX,"Protagonist Therapeutics, Inc. - Common Stock",Q,active,nasdaq,,,,생명 공학 및 의학 연구,56202010.0,,,,,True,2499,
PTHS,Pelthos Therapeutics Inc. Common Stock,A,active,nasdaq,,,,제약,56201040.0,,,,,True,608,
PTLE,PTL LTD - Class A Ordinary Shares,Q,active,nasdaq,,,,"오일, 가스 정제 및 마케팅",50102030.0,,,,,True,441,
PTLO,Portillo's Inc. - Class A Common Stock,Q,active,nasdaq,,,,레스토랑 및 바,53301020.0,,,,,True,1191,
PTN,"Palatin Technologies, Inc. - Common Stock",Q,active,nasdaq,,,,생명 공학 및 의학 연구,56202010.0,,,,US6960774031,True,7235,
PTON,"Peloton Interactive, Inc. - Common Stock",Q,active,nasdaq,,,,오락용 제품,53205020.0,,,,US70614W1009,True,1713,
PTOR,Praetorian Acquisition Corp. - Class A Ordinary Shares,Q,active,nasdaq,,,,투자 지주 회사,55601010.0,,,,,True,88,
PTRN,Pattern Group Inc. - Series A Common Stock,Q,active,nasdaq,,,,IT 서비스 및 컨설팅,57201010.0,,,,,True,210,
PTY,Pimco Corporate & Income Opportunity Fund,N,active,nasdaq,,,,폐쇄형 펀드,55501030.0,,,,,True,5929,
PUBM,"PubMatic, Inc. - Class A Common Stock",Q,active,nasdaq,,,,소프트웨어,57201020.0,,,,,True,1409,
PUK,Prudential Public Limited Company Common Stock,N,active,nasdaq,,,,생명 및 건강 보험,55301030.0,,,,US74435K2042,True,6553,
PULM,"Pulmatrix, Inc. - Common Stock",Q,active,nasdaq,,,,생명 공학 및 의학 연구,56202010.0,,,,,True,3101,
PUMP,ProPetro Holding Corp. Common Stock,N,active,nasdaq,,,,오일 관련 서비스 및 장비,50103020.0,,,,US74347M1080,True,2349,
PURR,Hyperliquid Strategies Inc - Common Stock,Q,active,nasdaq,,,,블록 체인 및 암호화폐,57301030.0,,,,,True,158,
PUSA,Aureus Greenway Holdings Inc. - Common Stock,Q,active,nasdaq,,,,여가 및 오락시설,53301040.0,,,,,True,361,
PVH,PVH Corp. Common Stock,N,active,nasdaq,,,,의류 및 액세서리,53202020.0,,,,US6936561009,True,11681,
PVLA,"Palvella Therapeutics, Inc. - Common Stock",Q,active,nasdaq,,,,생명 공학 및 의학 연구,56202010.0,,,,,True,2904,
PW,Power REIT (MD) Common Stock,A,active,nasdaq,,,,상업용 REITs,60102020.0,,,,US73933H1014,True,13467,
PWCM,"PowerCompute, Inc. - Common Stock",Q,unavailable,nasdaq,,,,블록 체인 및 암호화폐,57301030.0,,,,,False,0,
PWP,Perella Weinberg Partners - Class A Common Stock,Q,active,nasdaq,,,,투자 은행 및 중개 서비스,55102010.0,,,,,True,1419,
PWR,"Quanta Services, Inc. Common Stock",N,active,nasdaq,,Industrials,Construction & Engineering,건설 및 엔지니어링,52201020.0,"Houston, Texas",1050915.0,1997,US74762E1029,True,7153,
PWRL,Powerlaw Corp. - Common Stock,Q,active,nasdaq,,,,,,,,,,True,39,
PXED,"Phoenix Education Partners, Inc. Common Stock",N,active,nasdaq,,,,"초, 중, 고등 교육기관",63102010.0,,,,,True,196,
PXLW,"Pixelworks, Inc. - Common Stock",Q,active,nasdaq,,,,반도체,57101010.0,,,,US72581M3051,True,6581,
PXS,Pyxis Tankers Inc. - Common Stock,Q,active,nasdaq,,,,해양 화물 및 물류,52405020.0,,,,MHY717261066,True,2692,
PYPD,PolyPid Ltd. - Ordinary Shares,Q,active,nasdaq,,,,제약,56201040.0,,,,,True,1524,
PYPL,"PayPal Holdings, Inc. - Common Stock",Q,active,nasdaq,,Financials,Transaction & Payment Processing Services,경영 지원 서비스,52203040.0,"San Jose, California",1633917.0,1998,US70450Y1038,True,2671,
PYT,PPlus Tr GSC-2 Tr Ctf Fltg Rate,N,active,nasdaq,,,,기업 금융 서비스,55101050.0,,,,,True,5532,
PYXS,"Pyxis Oncology, Inc. - Common Stock",Q,active,nasdaq,,,,생명 공학 및 의학 연구,56202010.0,,,,,True,1200,
PZG,Paramount Gold Nevada Corp. Common Stock,A,active,nasdaq,,,,금,51201060.0,,,,US69924M1099,True,2837,
PZZA,"Papa John's International, Inc. - Common Stock",Q,active,nasdaq,,,,레스토랑 및 바,53301020.0,,,,US6988131024,True,8337,
Q,"Qnity Electronics, Inc. Common Stock",N,active,nasdaq,,Information Technology,Semiconductor Materials & Equipment,반도체,57101010.0,"Wilmington, Delaware",2058873.0,2025,,True,77,
QADR,QDRO Acquisition Corp. - Class A Ordinary Shares,Q,active,nasdaq,,,,투자 지주 회사,55601010.0,,,,,True,42,
QBTS,D-Wave Quantum Inc. Common Shares,N,active,nasdaq,,,,IT 서비스 및 컨설팅,57201010.0,,,,,True,1407,
QCLS,"Q/C Technologies, Inc. - Common Stock",Q,active,nasdaq,,,,블록 체인 및 암호화폐,57301030.0,,,,,True,3142,
QCOM,QUALCOMM Incorporated - Common Stock,Q,active,nasdaq,,Information Technology,Semiconductors,반도체,57101010.0,"San Diego, California",804328.0,1985,US7475251036,True,8711,
QCRH,"QCR Holdings, Inc. - Common Stock",Q,active,nasdaq,,,,은행,55101010.0,,,,US74727A1043,True,8253,
QDEL,QuidelOrtho Corporation - Common Stock,Q,active,nasdaq,,,,첨단 의료 장비 및 기술,56101010.0,,,,,True,8930,
QETA,Quetta Acquisition Corporation - Common Stock,Q,active,nasdaq,,,,투자 지주 회사,55601010.0,,,,,True,660,
QETAR,Quetta Acquisition Corporation - Right,Q,unavailable,nasdaq,,,,투자 지주 회사,55601010.0,,,,,False,0,
QFIN,"Qfin Holdings, Inc.  - American Depositary Shares",Q,active,nasdaq,,,,소비자 대출,55101030.0,,,,US88557W1018,True,1909,
QGEN,Qiagen N.V. Common Shares,N,active,nasdaq,,,,생명 공학 및 의학 연구,56202010.0,,,,NL0012169213,True,7563,
QH,Quhuo Limited - Class A Ordinary Shares,Q,active,nasdaq,,,,"배달, 우편, 항공 화물 및 육상 물류",52405010.0,,,,,True,1515,
QLEP,Quantum Leap Acquisition Corp Class A Ordinary Shares,N,active,nasdaq,,,,투자 지주 회사,55601010.0,,,,,True,21,
QLYS,"Qualys, Inc. - Common Stock",Q,active,nasdaq,,,,IT 서비스 및 컨설팅,57201010.0,,,,US74758T3032,True,3471,
QMCO,Quantum Corporation - Common Stock,Q,active,nasdaq,,,,컴퓨터 하드웨어,57106010.0,,,,,True,6784,
QMLS,"QumulusAI, Inc. - Common Stock",Q,active,nasdaq,,,,IT 서비스 및 컨설팅,57201010.0,,,,,True,5,
QMMM,QMMM Holdings Limited - Class A Ordinary Shares,Q,active,nasdaq,,,,광고 및 마케팅,53302010.0,,,,,True,502,
QNC,Quantum eMotion Corp. Common Shares,A,active,nasdaq,,,,컴퓨터 하드웨어,57106010.0,,,,,True,103,
QNCX,"Quince Therapeutics, Inc. - Common Stock",Q,active,nasdaq,,,,생명 공학 및 의학 연구,56202010.0,,,,,True,1810,
QNRX,"Quoin Pharmaceuticals, Ltd. - American Depositary Shares",Q,active,nasdaq,,,,생명 공학 및 의학 연구,56202010.0,,,,,True,2507,
QNST,"QuinStreet, Inc. - Common Stock",Q,active,nasdaq,,,,온라인 서비스,57201030.0,,,,US74874Q1004,True,4135,
QNT,Quantinuum Inc. - Class A Common Stock,Q,active,nasdaq,,,,IT 서비스 및 컨설팅,57201010.0,,,,,True,33,
QNTM,Quantum Biopharma Ltd. - Class B Subordinate Voting Shares,Q,active,nasdaq,,,,생명 공학 및 의학 연구,56202010.0,,,,,True,2040,
QQQX,Nuveen NASDAQ 100 Dynamic Overwrite Fund - Closed End Fund,Q,active,nasdaq,,,,폐쇄형 펀드,55501030.0,,,,,True,4898,
QRED,QuasarEdge Acquisition Corporation Ordinary Shares,N,active,nasdaq,,,,투자 지주 회사,55601010.0,,,,,True,52,
QRED.R,QuasarEdge Acquisition Corporation Rights to receive one-fourth (1/4) of one Ordinary Share,N,unavailable,nasdaq,,,,,,,,,,False,0,
QRFT,Exchange Listed Funds Trust,P,active,deleted,,,,,,,,,,True,1801,
QRHC,Quest Resource Holding Corporation - Common Stock,Q,active,nasdaq,,,,환경 서비스 및 장비,52203010.0,,,,US74836W2035,True,4161,
QRVO,"Qorvo, Inc. - Common Stock",Q,active,nasdaq,,,,반도체,57101010.0,,,,US74736K1016,True,2904,
QS,QuantumScape Corporation - Common Stock,Q,active,nasdaq,,,,"자동차, 트럭 및 오토바이 부품",53101020.0,,,,,True,1489,
QSEA,Quartzsea Acquisition Corporation - Ordinary Shares,Q,active,nasdaq,,,,투자 지주 회사,55601010.0,,,,,True,299,
QSEAR,Quartzsea Acquisition Corporation - Rights,Q,unavailable,nasdaq,,,,투자 지주 회사,55601010.0,,,,,False,0,
QSI,Quantum-Si Incorporated - Class A Common Stock,Q,active,nasdaq,,,,생명 공학 및 의학 연구,56202010.0,,,,,True,1426,
QSR,Restaurant Brands International Inc. Common Shares,N,active,nasdaq,,,,레스토랑 및 바,53301020.0,,,,,True,2918,
QTEX,QTREX Quantum Ltd. - Ordinary Shares,Q,active,nasdaq,,,,첨단 의료 장비 및 기술,56101010.0,,,,,True,1261,
QTI,"QT Imaging Holdings, Inc. - Common Stock",Q,active,nasdaq,,,,첨단 의료 장비 및 기술,56101010.0,,,,,True,1181,
QTRX,Quanterix Corporation - Common Stock,Q,active,nasdaq,,,,첨단 의료 장비 및 기술,56101010.0,,,,US74766Q1013,True,2165,
QTTB,Q32 Bio Inc. - Common Stock,Q,active,nasdaq,,,,생명 공학 및 의학 연구,56202010.0,,,,,True,2090,
QTWO,"Q2 Holdings, Inc. Common Stock",N,active,nasdaq,,,,소프트웨어,57201020.0,,,,,True,3103,
QUAD,"Quad Graphics, Inc Class A Common Stock",N,active,nasdaq,,,,상업 인쇄 서비스,52203020.0,,,,US7473011093,True,4036,
QUBT,Quantum Computing Inc. - Common Stock,Q,active,nasdaq,,,,소프트웨어,57201020.0,,,,,True,4898,
QUCY,Quantum Cyber N.V. - Ordinary Shares,Q,active,nasdaq,,,,IT 서비스 및 컨설팅,57201010.0,,,,,True,1180,
QUIK,QuickLogic Corporation - Common Stock,Q,active,nasdaq,,,,반도체,57101010.0,,,,US74837P1084,True,6730,
QUMS,Quantumsphere Acquisition Corp. - Ordinary Shares,Q,active,nasdaq,,,,투자 지주 회사,55601010.0,,,,,True,202,
QUMSR,Quantumsphere Acquisition Corp. - Rights,Q,unavailable,nasdaq,,,,투자 지주 회사,55601010.0,,,,,False,0,
QURE,uniQure N.V. - Ordinary Shares,Q,active,nasdaq,,,,생명 공학 및 의학 연구,56202010.0,,,,NL0010696654,True,3133,
QXL,Quantum X Labs Inc. - Common Stock,Q,active,nasdaq,,,,소프트웨어,57201020.0,,,,,True,3474,
QXO,"QXO, Inc. Common Stock",N,active,nasdaq,,,,건설 자재 및 비품,53203020.0,,,,,True,3586,
R,"Ryder System, Inc. Common Stock",N,active,nasdaq,,,,지상 화물 및 물류,52405030.0,,,,US7835491082,True,11733,
RA,Brookfield Real Assets Income Fund Inc. Common Stock,N,active,nasdaq,,,,폐쇄형 펀드,55501030.0,,,,,True,2420,
RAC,Rithm Acquisition Corp. Class A Ordinary Shares,N,active,nasdaq,,,,투자 지주 회사,55601010.0,,,,,True,315,
RACC,Research Alliance Corporation III - Class A Ordinary Shares,Q,active,nasdaq,,,,투자 지주 회사,55601010.0,,,,,True,43,
RACD,Research Alliance Corporation IV - Class A Ordinary Shares,Q,active,nasdaq,,,,투자 지주 회사,55601010.0,,,,,True,8,
RACE,Ferrari N.V. Common Shares,N,active,nasdaq,,,,자동차 및 트럭 제조,53101010.0,,,,,True,2702,
RADX,Radiopharm Theranostics Limited - American Depositary Shares,Q,active,nasdaq,,,,제약,56201040.0,,,,,True,405,
RAIL,"Freightcar America, Inc. - Common Stock",Q,active,nasdaq,,,,중장비 및 차량,52102020.0,,,,US3570231007,True,5357,
RAIN,"Rain Enhancement Technologies Holdco, Inc. - Class A Common Stock",Q,active,nasdaq,,,,산업용 기계 및 장비,52102010.0,,,,,True,388,
RAL,Ralliant Corporation Common Stock,N,active,nasdaq,,,,산업용 기계 및 장비,52102010.0,,,,,True,270,
RAMP,"LiveRamp Holdings, Inc. Common Stock",N,active,nasdaq,,,,소프트웨어,57201020.0,,,,US53815P1084,True,10733,
RAND,Rand Capital Corporation - Closed End Fund,Q,active,nasdaq,,,,투자 관리 및 펀드 운영,55102020.0,,,,,True,11680,
RANG,Range Capital Acquisition Corp. - Ordinary Shares,Q,active,nasdaq,,,,투자 지주 회사,55601010.0,,,,,True,380,
RANGR,Range Capital Acquisition Corp. - Rights,Q,unavailable,nasdaq,,,,투자 지주 회사,55601010.0,,,,,False,0,
RANI,"Rani Therapeutics Holdings, Inc. - Class A Common Stock",Q,active,nasdaq,,,,생명 공학 및 의학 연구,56202010.0,,,,,True,1249,
RAPP,"Rapport Therapeutics, Inc. - Common Stock",Q,active,nasdaq,,,,생명 공학 및 의학 연구,56202010.0,,,,,True,531,
RARE,Ultragenyx Pharmaceutical Inc. - Common Stock,Q,active,nasdaq,,,,제약,56201040.0,,,,US90400D1081,True,3136,
RAVE,"Rave Restaurant Group, Inc. - Common Stock",Q,active,nasdaq,,,,레스토랑 및 바,53301020.0,,,,US7541981095,True,8277,
RAY,Raytech Holding Limited - Ordinary Shares,Q,active,nasdaq,,,,가정용 전자 제품,57106030.0,,,,,True,546,
RAYA,Erayak Power Solution Group Inc. - Class A Ordinary Shares,Q,active,nasdaq,,,,전기 부품 및 장비,52102030.0,,,,,True,902,
RBA,"RB Global, Inc. Common Stock",N,active,nasdaq,,,,경영 지원 서비스,52203040.0,,,,,True,7136,
RBB,RBB Bancorp - Common Stock,Q,active,nasdaq,,,,은행,55101010.0,,,,US74930B1052,True,2259,
RBBN,Ribbon Communications Inc.  - Common Stock,Q,active,nasdaq,,,,통신 및 네트워킹,57102010.0,,,,US7625441040,True,6577,
RBC,RBC Bearings Incorporated Common Stock,N,active,nasdaq,,,,산업용 기계 및 장비,52102010.0,,,,US7587501039,True,5269,
RBCAA,"Republic Bancorp, Inc. - Class A Common Stock",Q,active,nasdaq,,,,은행,55101010.0,,,,US7602812049,True,7043,
RBKB,"Rhinebeck Bancorp, Inc. - Common Stock",Q,active,nasdaq,,,,은행,55101010.0,,,,US7620931029,True,1887,
RBLX,Roblox Corporation Class A Common Stock,N,active,nasdaq,,,,소프트웨어,57201020.0,,,,,True,1348,
RBNE,Robin Energy Ltd. - Common Stock,Q,active,nasdaq,,,,오일 및 가스 수송 서비스,50103030.0,,,,,True,320,
RBRK,"Rubrik, Inc. Class A Common Stock",N,active,nasdaq,,,,소프트웨어,57201020.0,,,,,True,561,
RC,Ready Capital Corporation Common Stock,N,active,nasdaq,,,,특수 REITs,60102040.0,,,,,True,3382,
RCAT,"Red Cat Holdings, Inc. - Common Stock",Q,active,nasdaq,,,,항공우주 및 방위,52101010.0,,,,,True,6165,
RCD,Ready Capital Corporation 9.00% Senior Notes due 2029,N,active,nasdaq,,,,특수 REITs,60102040.0,,,,,True,396,
RCEL,"Avita Medical, Inc. - Common Stock",Q,active,nasdaq,,,,생명 공학 및 의학 연구,56202010.0,,,,US0537921076,True,3567,
RCG,"RENN Fund, Inc Common Stock",A,active,nasdaq,,,,폐쇄형 펀드,55501030.0,,,,US7597201059,True,7605,
RCI,"Rogers Communication, Inc. Common Stock",N,active,nasdaq,,,,무선 통신 서비스,57401020.0,,,,CA7751092007,True,7681,
RCKT,"Rocket Pharmaceuticals, Inc. - Common Stock",Q,active,nasdaq,,,,생명 공학 및 의학 연구,56202010.0,,,,US77313F1066,True,2873,
RCKY,"Rocky Brands, Inc. - Common Stock",Q,active,nasdaq,,,,제화,53202030.0,,,,US7745151008,True,8423,
RCL,Royal Caribbean Cruises Ltd. Common Stock,N,active,nasdaq,,Consumer Discretionary,"Hotels, Resorts & Cruise Lines","호텔, 모텔 및 크루즈 라인",53301010.0,"Miami, Florida",884887.0,1997,LR0008862868,True,8365,
RCMT,"RCM Technologies, Inc. - Common Stock",Q,active,nasdaq,,,,고용 서비스,52203030.0,,,,US7493604000,True,10799,
RCON,"Recon Technology, Ltd. - Class A Ordinary Shares",Q,active,nasdaq,,,,오일 관련 서비스 및 장비,50103020.0,,,,KYG7415M1087,True,4270,
RCS,"PIMCO Strategic Income Fund, Inc.",N,active,nasdaq,,,,투자 관리 및 펀드 운영,55102020.0,,,,,True,8139,
RCT,RedCloud Holdings plc - Ordinary Shares,Q,active,nasdaq,,,,온라인 서비스,57201030.0,,,,,True,335,
RCUS,"Arcus Biosciences, Inc. Common Stock",N,active,nasdaq,,,,생명 공학 및 의학 연구,56202010.0,,,,,True,2099,
RDAC,Rising Dragon Acquisition Corp. - Ordinary Shares,Q,active,nasdaq,,,,투자 지주 회사,55601010.0,,,,,True,409,
RDACR,Rising Dragon Acquisition Corp. - Rights,Q,unavailable,nasdaq,,,,투자 지주 회사,55601010.0,,,,,False,0,
RDAG,Republic Digital Acquisition Company - Class A Ordinary Shares,Q,active,nasdaq,,,,투자 지주 회사,55601010.0,,,,,True,271,
RDCM,Radcom Ltd. - Ordinary Shares,Q,active,nasdaq,,,,통신 및 네트워킹,57102010.0,,,,IL0010826688,True,7249,
RDDT,"Reddit, Inc. Class A Common Stock",N,active,nasdaq,,,,온라인 서비스,57201030.0,,,,,True,585,
RDGT,"Ridgetech, Inc. - Ordinary Shares",Q,active,nasdaq,,,,백화점,53402010.0,,,,,True,4226,
RDHL,Redhill Biopharma Ltd. - American Depositary Shares,Q,active,nasdaq,,,,제약,56201040.0,,,,,True,3405,
RDI,Reading International Inc - Class A Non-voting Common Stock,Q,active,nasdaq,,,,여가 및 오락시설,53301040.0,,,,US7554081015,True,10734,
RDIB,Reading International Inc - Class B Voting Common Stock,Q,active,nasdaq,,,,여가 및 오락시설,53301040.0,,,,US7554082005,True,6674,
RDN,Radian Group Inc. Common Stock,N,active,nasdaq,,,,손해보험,55301020.0,,,,US7502361014,True,8488,
RDNT,"RadNet, Inc. - Common Stock",Q,active,nasdaq,,,,의료 시설 및 서비스,56102010.0,,,,,True,7433,
RDNW,"RideNow Group, Inc. - Class B Common Stock",Q,active,nasdaq,,,,"자동차 차량, 부품 및 서비스 소매",53403010.0,,,,,True,2379,
